GEOID,Name,Short Name,Primary County GEOID,Population,Housing Units,Land Area,Water Area,Latitude,Longitude
00037,"Abbeville, LA Urban Area","Abbeville, LA",22113,17742,8938,11.129,0.131,29.96865,-92.095225
00064,"Abbeville, SC Urban Area","Abbeville, SC",45001,5084,2358,4.948,0.002,34.176729,-82.382945
00145,"Aberdeen, SD Urban Area","Aberdeen, SD",46013,27849,13245,13.895,0.071,45.463204,-98.468811
00172,"Aberdeen, WA Urban Area","Aberdeen, WA",53027,27286,11611,10.972,0.696,46.974594,-123.831816
00253,"Abilene, KS Urban Area","Abilene, KS",20041,6665,3351,3.64,0.001,38.92106,-97.220754
00280,"Abilene, TX Urban Area","Abilene, TX",48441,119007,51852,61.973,0.392,32.42579,-99.74988
00388,"Ada, OH Urban Area","Ada, OH",39065,4553,1767,2.095,0.0,40.767953,-83.825064
00415,"Ada, OK Urban Area","Ada, OK",40123,17311,8469,14.25,0.012,34.775053,-96.673796
00442,"Adairsville, GA Urban Area","Adairsville, GA",13015,5444,1748,5.351,0.0,34.368886,-84.93652
00469,"Adel, GA Urban Area","Adel, GA",13075,6977,3118,6.111,0.066,31.145787,-83.427248
00496,"Adel, IA Urban Area","Adel, IA",19049,5459,2150,2.743,0.006,41.61053,-94.023973
00550,"Adjuntas, PR Urban Area","Adjuntas, PR",72001,8078,3536,4.863,0.0,18.16311,-66.720634
00577,"Adrian, MI Urban Area","Adrian, MI",26091,29187,12218,13.375,0.149,41.899205,-84.04018
00631,"Aguadilla--Isabela--San Sebastián, PR Urban Area","Aguadilla, PR",72005,232443,112538,187.321,0.143,18.391426,-67.091325
00658,"Ahoskie, NC Urban Area","Ahoskie, NC",37091,4754,2438,3.326,0.0,36.286472,-76.983542
00660,"Aibonito, PR Urban Area","Aibonito, PR",72009,19535,8709,13.305,0.025,18.13458,-66.275739
00766,"Akron, OH Urban Area","Akron, OH",39153,539350,252905,300.637,5.82,41.073342,-81.495355
00820,"Alamogordo, NM Urban Area","Alamogordo, NM",35035,30707,15449,13.731,0.002,32.892453,-105.952133
00847,"Alamosa, CO Urban Area","Alamosa, CO",08003,10428,4505,7.685,0.015,37.464471,-105.875242
00901,"Albany, GA Urban Area","Albany, GA",13095,84302,39536,66.507,0.736,31.586505,-84.172328
00955,"Albany, OR Urban Area","Albany, OR",41043,62192,24492,23.049,0.074,44.635118,-123.093403
00970,"Albany--Schenectady, NY Urban Area","Albany, NY",36001,594848,274163,271.303,5.434,42.742965,-73.799324
00982,"Albemarle, NC Urban Area","Albemarle, NC",37167,16779,8354,16.661,0.018,35.379959,-80.188772
01009,"Albert Lea, MN Urban Area","Albert Lea, MN",27047,18046,8518,10.797,0.539,43.653783,-93.365114
01036,"Albertville, AL Urban Area","Albertville, AL",01095,38371,15380,34.843,0.237,34.269468,-86.217373
01090,"Albion, MI Urban Area","Albion, MI",26025,8031,3128,4.691,0.053,42.249581,-84.755351
01117,"Albion, NY Urban Area","Albion, NY",36073,6978,2990,2.945,0.0,43.24579,-78.193578
01171,"Albuquerque, NM Urban Area","Albuquerque, NM",35001,770082,337882,263.072,2.689,35.131816,-106.623826
01252,"Alexander City, AL Urban Area","Alexander City, AL",01123,8472,4324,9.79,0.014,32.943492,-85.962142
01273,"Alexandria, IN Urban Area","Alexandria, IN",18095,6064,3136,3.804,0.005,40.257609,-85.679057
01279,"Alexandria, LA Urban Area","Alexandria, LA",22079,76791,35731,64.711,0.715,31.3237,-92.447707
01306,"Alexandria, MN Urban Area","Alexandria, MN",27041,19301,10233,22.572,7.309,45.891937,-95.378886
01387,"Algona, IA Urban Area","Algona, IA",19109,5406,2702,3.352,0.006,43.073988,-94.228673
01414,"Alice, TX Urban Area","Alice, TX",48249,19464,7517,10.031,0.0,27.750622,-98.07342
01441,"Allegan, MI Urban Area","Allegan, MI",26005,6804,2707,6.879,0.879,42.536282,-85.850898
01450,"Allendale, MI Urban Area","Allendale, MI",26139,23377,7448,10.545,0.061,42.964159,-85.929201
01495,"Allentown--Bethlehem, PA--NJ Urban Area","Allentown, PA",42077,625350,252956,261.546,3.592,40.639158,-75.414498
01522,"Alliance, NE Urban Area","Alliance, NE",31013,7879,3888,4.905,0.012,42.09978,-102.873281
01549,"Alliance, OH Urban Area","Alliance, OH",39151,31274,14323,17.254,0.089,40.913518,-81.097902
01630,"Alma--St. Louis, MI Urban Area","Alma, MI",26057,17033,5460,9.035,0.213,43.390674,-84.641499
01684,"Alpena, MI Urban Area","Alpena, MI",26007,15359,8035,12.709,0.769,45.04959,-83.453573
01701,"Alpine, CA Urban Area","Alpine, CA",06073,14654,5250,9.846,0.001,32.825726,-116.781139
01711,"Alpine, TX Urban Area","Alpine, TX",48043,6286,3792,4.287,0.0,30.360219,-103.667414
01738,"Altavista, VA Urban Area","Altavista, VA",51031,4644,2169,5.941,0.063,37.113134,-79.291707
01765,"Alton, IL Urban Area","Alton, IL",17119,79622,37952,59.658,0.951,38.898528,-90.121266
01792,"Altoona, PA Urban Area","Altoona, PA",42013,73939,35046,37.012,0.062,40.477649,-78.398538
01846,"Altus, OK Urban Area","Altus, OK",40065,18811,9139,15.657,0.203,34.657061,-99.309046
01873,"Alva, OK Urban Area","Alva, OK",40151,5150,2617,3.646,0.0,36.799658,-98.665505
01900,"Alvarado, TX Urban Area","Alvarado, TX",48251,4973,1856,3.044,0.015,32.412336,-97.216697
01927,"Amarillo, TX Urban Area","Amarillo, TX",48375,205613,88626,83.993,0.687,35.192028,-101.846942
02008,"Americus, GA Urban Area","Americus, GA",13261,17216,7654,10.979,0.06,32.077399,-84.219732
02062,"Ames, IA Urban Area","Ames, IA",19169,65725,27550,22.357,0.081,42.02461,-93.629124
02103,"Amherst Town--Northampton--Easthampton Town, MA Urban Area","Amherst Town, MA",25015,84946,34870,54.652,0.668,42.275255,-72.653406
02143,"Amory, MS Urban Area","Amory, MS",28095,6304,3078,5.606,0.011,33.983635,-88.478932
02170,"Amsterdam, NY Urban Area","Amsterdam, NY",36057,21395,10986,10.055,0.325,42.952606,-74.192053
02197,"Anaconda-Deer Lodge County, MT Urban Area","Anaconda, MT",30023,6664,3928,2.61,0.0,46.132279,-112.96175
02224,"Anacortes, WA Urban Area","Anacortes, WA",53057,18693,9037,9.858,0.351,48.491868,-122.639049
02251,"Anadarko, OK Urban Area","Anadarko, OK",40015,4970,2189,2.105,0.0,35.071102,-98.24162
02278,"Anamosa, IA Urban Area","Anamosa, IA",19105,5434,2059,2.647,0.003,42.110052,-91.27386
02305,"Anchorage, AK Urban Area","Anchorage, AK",02020,249129,102702,91.689,1.072,61.169584,-149.854154
02332,"Anchorage Northeast, AK Urban Area","Anchorage Northeast, AK",02020,29158,11743,17.683,0.184,61.325491,-149.537602
02359,"Andalusia, AL Urban Area","Andalusia, AL",01039,6085,3207,6.863,0.04,31.305196,-86.479475
02386,"Anderson, IN Urban Area","Anderson, IN",18095,80252,37297,52.17,0.153,40.086247,-85.676223
02420,"Anderson--Clemson, SC Urban Area","Anderson, SC",45007,118281,51230,95.94,2.827,34.553063,-82.696322
02467,"Andrews, TX Urban Area","Andrews, TX",48003,15156,5920,9.515,0.012,32.323743,-102.541184
02500,"Angleton, TX Urban Area","Angleton, TX",48039,20317,8863,10.948,0.019,29.170738,-95.428262
02548,"Angola, IN Urban Area","Angola, IN",18151,13037,6938,12.428,2.279,41.670453,-85.030874
02575,"Anna, IL Urban Area","Anna, IL",17181,6068,2858,4.429,0.022,37.461878,-89.248104
02602,"Ann Arbor, MI Urban Area","Ann Arbor, MI",26161,314278,137848,143.455,5.152,42.237327,-83.649391
02629,"Anniston--Oxford, AL Urban Area","Anniston, AL",01015,78285,36090,78.896,0.428,33.668326,-85.833914
02656,"Antigo, WI Urban Area","Antigo, WI",55067,8258,4448,4.848,0.046,45.142639,-89.153197
02683,"Antioch, CA Urban Area","Antioch, CA",06013,327263,105608,73.347,0.787,37.985757,-121.79064
02764,"Appleton, WI Urban Area","Appleton, WI",55087,232870,100324,107.775,4.116,44.250467,-88.409398
02791,"Arab, AL Urban Area","Arab, AL",01095,7809,3257,8.695,0.108,34.330357,-86.500846
02818,"Aransas Pass--Port Aransas--Ingleside, TX Urban Area","Aransas Pass, TX",48409,22569,14660,24.644,0.221,27.901076,-97.153623
02912,"Arcadia, FL Urban Area","Arcadia, FL",12027,16242,7586,10.004,0.006,27.208552,-81.852524
02930,"Arcata, CA Urban Area","Arcata, CA",06023,19429,8734,7.928,0.046,40.877492,-124.078895
03007,"Ardmore, OK Urban Area","Ardmore, OK",40019,21261,9809,15.019,0.139,34.177688,-97.13738
03034,"Arecibo, PR Urban Area","Arecibo, PR",72065,125368,57529,75.493,0.096,18.454313,-66.810062
03088,"Arizona City, AZ Urban Area","Arizona City, AZ",04021,8305,4239,4.339,0.077,32.749832,-111.673175
03115,"Arkadelphia, AR Urban Area","Arkadelphia, AR",05019,10084,4189,6.2,0.0,34.126249,-93.068945
03142,"Arkansas City, KS Urban Area","Arkansas City, KS",20035,11745,5519,6.832,0.0,37.065618,-97.040529
03158,"Arlington, TN Urban Area","Arlington, TN",47157,14124,4664,7.675,0.034,35.284261,-89.665147
03196,"Arroyo Grande--Grover Beach--Pismo Beach, CA Urban Area","Arroyo Grande, CA",06079,51111,25873,17.075,0.061,35.123896,-120.604569
03223,"Artesia, NM Urban Area","Artesia, NM",35015,14304,6362,6.849,0.007,32.843287,-104.40931
03250,"Arvin, CA Urban Area","Arvin, CA",06029,19342,4585,2.345,0.0,35.203159,-118.832837
03262,"Asbury Lake--Middleburg, FL Urban Area","Asbury Lake, FL",12019,23236,9948,23.003,0.27,30.060172,-81.852388
03277,"Ashburn, GA Urban Area","Ashburn, GA",13287,4798,2021,4.247,0.042,31.696905,-83.647136
03331,"Asheboro, NC Urban Area","Asheboro, NC",37151,37443,16354,27.421,0.122,35.734505,-79.812027
03358,"Asheville, NC Urban Area","Asheville, NC",37021,295054,143788,248.585,1.904,35.509787,-82.522474
03385,"Ashland, OH Urban Area","Ashland, OH",39005,19185,8895,9.852,0.036,40.865865,-82.318339
03395,"Ashland, PA Urban Area","Ashland, PA",42107,4402,2683,1.419,0.0,40.793666,-76.284347
03412,"Ashland, WI Urban Area","Ashland, WI",55003,7079,3545,4.223,0.001,46.587261,-90.877925
03466,"Ashtabula, OH Urban Area","Ashtabula, OH",39007,27313,14044,21.69,0.18,41.871766,-80.815232
03493,"Ashville, OH Urban Area","Ashville, OH",39129,7412,2754,3.807,0.0,39.714159,-82.974496
03520,"Aspen, CO Urban Area","Aspen, CO",08097,7299,6372,5.212,0.0,39.198226,-106.84115
03547,"Astoria, OR Urban Area","Astoria, OR",41007,15948,7482,9.669,0.13,46.190059,-123.810292
03601,"Atchison, KS Urban Area","Atchison, KS",20005,10746,4245,5.385,0.044,39.565798,-95.13284
03655,"Athens, AL Urban Area","Athens, AL",01083,25167,11501,20.092,0.115,34.797624,-86.962366
03682,"Athens, OH Urban Area","Athens, OH",39009,26311,10059,9.453,0.144,39.332266,-82.104873
03709,"Athens, TN Urban Area","Athens, TN",47107,15568,7372,15.473,0.0,35.452502,-84.609521
03736,"Athens, TX Urban Area","Athens, TX",48213,12342,4850,9.32,0.025,32.198133,-95.849966
03763,"Athens-Clarke County, GA Urban Area","Athens, GA",13059,144727,61888,91.847,0.937,33.944601,-83.396107
03790,"Athol, MA Urban Area","Athol, MA",25027,13803,6159,10.611,0.461,42.599692,-72.237254
03817,"Atlanta, GA Urban Area","Atlanta, GA",13121,5152073,2068065,2450.521,36.379,33.834858,-84.337701
03844,"Atlanta, TX Urban Area","Atlanta, TX",48067,4948,2460,6.809,0.038,33.13,-94.169682
03871,"Atlantic, IA Urban Area","Atlantic, IA",19029,6571,3426,4.492,0.044,41.397778,-95.009637
03904,"Atlantic City--Ocean City--Villas, NJ Urban Area","Atlantic City, NJ",34001,296056,201191,162.875,4.106,39.239372,-74.66394
03925,"Atmore, AL Urban Area","Atmore, AL",01053,6314,3298,5.104,0.02,31.025074,-87.488688
03957,"Atoka, TN Urban Area","Atoka, TN",47167,13152,5175,9.925,0.028,35.436176,-89.777209
04021,"Aubrey, TX Urban Area","Aubrey, TX",48121,6050,2465,2.74,0.004,33.290517,-96.98788
04033,"Auburn, AL Urban Area","Auburn, AL",01081,103995,46470,61.156,0.569,32.611382,-85.452135
04060,"Auburn, IN Urban Area","Auburn, IN",18033,20425,8898,9.883,0.0,41.361557,-85.075974
04114,"Auburn, NY Urban Area","Auburn, NY",36011,30546,15230,13.139,0.082,42.922279,-76.558539
04130,"Auburn, CA Urban Area","Auburn, CA",06061,32425,14085,17.239,0.009,38.925771,-121.080791
04146,"Au Gres, MI Urban Area","Au Gres, MI",26011,1878,2164,3.963,0.065,44.043392,-83.689549
04168,"Augusta, KS Urban Area","Augusta, KS",20015,9252,3875,3.716,0.268,37.694382,-96.973186
04195,"Augusta, ME Urban Area","Augusta, ME",23011,24858,12940,21.918,0.723,44.323856,-69.807516
04222,"Augusta-Richmond County, GA--SC Urban Area","Augusta, GA",13245,430939,187263,273.292,2.224,33.485271,-82.001784
04276,"Aurora, MO Urban Area","Aurora, MO",29109,7878,3693,5.278,0.016,36.965645,-93.720407
04357,"Austin, MN Urban Area","Austin, MN",27099,25531,10769,10.047,0.098,43.668767,-92.976697
04384,"Austin, TX Urban Area","Austin, TX",48453,1855197,808591,619.621,4.895,30.380036,-97.765795
04438,"Avalon, CA Urban Area","Avalon, CA",06037,3290,1832,1.189,0.0,33.34166,-118.329744
04465,"Avenal, CA Urban Area","Avenal, CA",06031,12824,2937,3.629,0.0,36.000567,-120.132966
04587,"Aztec, NM Urban Area","Aztec, NM",35045,7327,3247,6.783,0.102,36.828868,-108.000173
04627,"Bainbridge, GA Urban Area","Bainbridge, GA",13087,12472,6022,10.676,0.237,30.906213,-84.572652
04654,"Baker City, OR Urban Area","Baker City, OR",41001,10066,4724,4.479,0.0,44.780684,-117.83368
04681,"Bakersfield, CA Urban Area","Bakersfield, CA",06029,574397,187970,132.121,0.983,35.365109,-119.049231
04843,"Baltimore, MD Urban Area","Baltimore, MD",24005,2201888,948420,654.935,21.539,39.23648,-76.642499
04924,"Bandon, OR Urban Area","Bandon, OR",41011,4442,2777,4.867,0.016,43.106208,-124.420961
04951,"Bangor, ME Urban Area","Bangor, ME",23019,62028,28584,51.116,1.862,44.798865,-68.806636
05005,"Baraboo, WI Urban Area","Baraboo, WI",55111,13924,6773,6.764,0.083,43.46854,-89.748766
05032,"Barbourville, KY Urban Area","Barbourville, KY",21121,5653,2678,5.297,0.028,36.860167,-83.870451
05040,"Barceloneta--Florida--Bajadero, PR Urban Area","Barceloneta, PR",72013,65521,29191,41.701,0.028,18.41848,-66.606724
05059,"Bardstown, KY Urban Area","Bardstown, KY",21179,18237,8041,13.37,0.105,37.830694,-85.459261
05113,"Barnesville, GA Urban Area","Barnesville, GA",13171,6668,2857,5.814,0.042,33.056346,-84.160191
05167,"Barnstable Town, MA Urban Area","Barnstable Town, MA",25001,303710,196034,341.279,34.86,41.627072,-70.61661
05221,"Barre--Montpelier, VT Urban Area","Barre, VT",50023,20644,10247,14.39,0.16,44.212909,-72.526918
05302,"Barstow, CA Urban Area","Barstow, CA",06071,29904,11921,12.382,0.0,34.886704,-117.032814
05329,"Bartlesville, OK Urban Area","Bartlesville, OK",40147,39594,17912,19.761,0.012,36.74927,-95.943864
05383,"Bartow, FL Urban Area","Bartow, FL",12105,18570,7388,7.914,0.258,27.890152,-81.838405
05410,"Basalt, CO Urban Area","Basalt, CO",08037,8194,3688,3.642,0.027,39.38358,-107.080731
05437,"Bastrop, LA Urban Area","Bastrop, LA",22067,12065,5639,10.328,0.041,32.776054,-91.911145
05464,"Bastrop, TX Urban Area","Bastrop, TX",48021,20940,8460,18.131,0.24,30.10718,-97.344734
05491,"Batavia, NY Urban Area","Batavia, NY",36037,17157,8607,8.069,0.046,43.002881,-78.176038
05518,"Batesburg-Leesville, SC Urban Area","Batesburg, SC",45063,4841,2446,5.6,0.063,33.908796,-81.529076
05545,"Batesville, AR Urban Area","Batesville, AR",05063,11221,5020,7.843,0.009,35.779394,-91.630531
05572,"Batesville, IN Urban Area","Batesville, IN",18137,7678,3120,5.474,0.068,39.30081,-85.215672
05599,"Batesville, MS Urban Area","Batesville, MS",28107,5927,2550,6.28,0.0,34.319332,-89.94112
05653,"Bath, NY Urban Area","Bath, NY",36101,6355,3465,2.905,0.095,42.339846,-77.312811
05680,"Baton Rouge, LA Urban Area","Baton Rouge, LA",22033,634486,276872,396.341,4.367,30.410839,-91.032862
05707,"Battle Creek, MI Urban Area","Battle Creek, MI",26025,76134,34747,47.332,1.602,42.313131,-85.20252
05734,"Battlement Mesa, CO Urban Area","Battlement Mesa, CO",08045,6642,2811,3.064,0.022,39.442496,-108.043023
05788,"Baxley, GA Urban Area","Baxley, GA",13001,5752,2746,6.259,0.005,31.771186,-82.346883
05842,"Bayard, NM Urban Area","Bayard, NM",35017,5137,2685,3.114,0.025,32.695934,-108.118383
05869,"Bay City, MI Urban Area","Bay City, MI",26017,67831,33061,39.932,1.139,43.608667,-83.890414
05896,"Bay City, TX Urban Area","Bay City, TX",48321,19196,8867,10.414,0.016,28.985126,-95.951212
05923,"Bay Minette, AL Urban Area","Bay Minette, AL",01003,8050,3305,6.955,0.055,30.881721,-87.777638
05935,"Bayside Gardens--Manzanita, OR Urban Area","Bayside Gardens, OR",41057,2811,3039,2.981,0.001,45.71741,-123.918666
05958,"Bealeton, VA Urban Area","Bealeton, VA",51061,5436,1821,4.369,0.008,38.571106,-77.769645
05977,"Beardstown, IL Urban Area","Beardstown, IL",17017,6236,2388,2.139,0.037,40.011448,-90.425261
06004,"Beatrice, NE Urban Area","Beatrice, NE",31067,12233,6105,8.691,0.065,40.274298,-96.744552
06031,"Beaufort--Port Royal, SC Urban Area","Beaufort, SC",45013,54015,22517,43.76,0.548,32.430552,-80.714653
06058,"Beaumont, TX Urban Area","Beaumont, TX",48245,144707,66732,96.099,1.474,30.110762,-94.129316
06085,"Beaver Dam, KY Urban Area","Beaver Dam, KY",21183,5394,2172,3.402,0.009,37.406682,-86.87647
06112,"Beaver Dam, WI Urban Area","Beaver Dam, WI",55027,18645,8984,9.384,0.028,43.471648,-88.82927
06139,"Beckley, WV Urban Area","Beckley, WV",54081,56311,27437,53.636,0.167,37.789184,-81.229955
06166,"Bedford, IN Urban Area","Bedford, IN",18093,14197,7173,8.508,0.001,38.862636,-86.498249
06193,"Bedford, PA Urban Area","Bedford, PA",42009,4164,2237,3.838,0.104,40.032726,-78.508804
06220,"Bedford, VA Urban Area","Bedford, VA",51019,7479,3596,8.576,0.012,37.339142,-79.524904
06247,"Beebe, AR Urban Area","Beebe, AR",05145,6923,3119,4.474,0.0,35.07041,-91.89251
06274,"Beeville, TX Urban Area","Beeville, TX",48025,13413,5769,6.313,0.0,28.406366,-97.748367
06290,"Bel Air--Aberdeen, MD Urban Area","Bel Air, MD",24025,216106,86885,107.198,1.396,39.510202,-76.286724
06301,"Belding, MI Urban Area","Belding, MI",26067,5712,2181,2.908,0.06,43.09647,-85.234104
06335,"Belfair, WA Urban Area","Belfair, WA",53045,5454,3139,5.349,0.001,47.445989,-122.8604
06355,"Belfast, ME Urban Area","Belfast, ME",23027,4439,3003,3.522,0.018,44.41684,-68.99446
06382,"Belgrade, MT Urban Area","Belgrade, MT",30031,19429,7984,13.349,0.041,45.7759,-111.18265
06436,"Bellefontaine, OH Urban Area","Bellefontaine, OH",39091,13950,6912,6.211,0.0,40.359387,-83.753111
06463,"Bellefonte, PA Urban Area","Bellefonte, PA",42027,15623,6538,7.84,0.0,40.911329,-77.786548
06490,"Belle Fourche, SD Urban Area","Belle Fourche, SD",46019,4864,2291,2.86,0.0,44.665885,-103.850796
06517,"Belle Glade, FL Urban Area","Belle Glade, FL",12099,22597,7226,7.21,0.0,26.683623,-80.67831
06571,"Belle Plaine, MN Urban Area","Belle Plaine, MN",27139,6963,2571,3.549,0.0,44.61807,-93.759712
06625,"Bellevue, OH Urban Area","Bellevue, OH",39143,8429,3846,4.47,0.07,41.277074,-82.84458
06652,"Bellingham, WA Urban Area","Bellingham, WA",53073,130771,59068,50.132,2.915,48.773005,-122.480881
06679,"Bellows Falls, VT--NH Urban Area","Bellows Falls, VT",50025,3802,2063,2.421,0.046,43.131472,-72.449764
06760,"Beloit, WI--IL Urban Area","Beloit, WI",55105,63516,25535,31.936,0.836,42.503862,-89.027523
06770,"Belterra, TX Urban Area","Belterra, TX",48209,11166,3549,3.359,0.0,30.188169,-97.987033
06779,"Belton, SC Urban Area","Belton, SC",45007,4898,1966,4.562,0.011,34.527111,-82.49847
06841,"Bemidji, MN Urban Area","Bemidji, MN",27007,14626,6855,14.459,1.045,47.48452,-94.89423
06868,"Bend, OR Urban Area","Bend, OR",41017,109902,49901,42.407,0.304,44.050969,-121.31822
06895,"Bennettsville, SC Urban Area","Bennettsville, SC",45069,8407,4599,7.47,0.494,34.621515,-79.684769
06922,"Bennington, VT Urban Area","Bennington, VT",50003,13266,5921,11.633,0.116,42.899989,-73.204499
06949,"Benson, AZ Urban Area","Benson, AZ",04003,4008,2521,2.714,0.002,31.961786,-110.294175
07030,"Benton, IL Urban Area","Benton, IL",17055,7642,3832,4.982,0.02,38.000944,-88.919648
07057,"Benton, KY Urban Area","Benton, KY",21157,4710,2235,4.127,0.055,36.851835,-88.359536
07084,"Benton, LA Urban Area","Benton, LA",22015,4392,1788,4.476,0.007,32.672625,-93.725459
07138,"Benton Harbor--Lincoln--St. Joseph, MI Urban Area","Benton Harbor, MI",26021,62731,31435,52.528,1.244,42.052276,-86.480381
07165,"Berea, KY Urban Area","Berea, KY",21151,16978,6567,11.478,0.052,37.583562,-84.293019
07192,"Berlin, NH Urban Area","Berlin, NH",33007,9994,5294,4.944,0.174,44.482025,-71.16291
07219,"Berlin, WI Urban Area","Berlin, WI",55047,5063,2470,3.455,0.013,43.970639,-88.947368
07300,"Berryville, AR Urban Area","Berryville, AR",05015,4941,2117,4.182,0.0,36.369166,-93.563263
07381,"Bethel, AK Urban Area","Bethel, AK",02050,4794,1930,15.0,0.252,60.7653,-161.804893
07472,"Beverly Hills--Homosassa Springs--Pine Ridge, FL Urban Area","Beverly Hills, FL",12017,99544,52145,118.827,3.69,28.892909,-82.443778
07508,"Big Bear, CA Urban Area","Big Bear, CA",06071,16187,21296,15.929,0.214,34.244205,-116.854109
07530,"Big Lake, MN Urban Area","Big Lake, MN",27141,12220,4115,5.424,0.821,45.339948,-93.745209
07597,"Big Pine Key, FL Urban Area","Big Pine Key, FL",12087,8952,6118,8.463,0.254,24.661751,-81.414396
07624,"Big Rapids, MI Urban Area","Big Rapids, MI",26107,10776,4805,7.343,0.059,43.692418,-85.481129
07651,"Big Spring, TX Urban Area","Big Spring, TX",48227,26553,11325,20.643,0.234,32.244288,-101.461699
07678,"Big Stone Gap, VA Urban Area","Big Stone Gap, VA",51195,6674,2636,6.581,0.089,36.864971,-82.764885
07705,"Billings, MT Urban Area","Billings, MT",30111,129337,57870,54.7,0.137,45.787459,-108.53712
07732,"Binghamton, NY Urban Area","Binghamton, NY",36007,152898,71962,69.729,3.066,42.10852,-75.964231
07759,"Birch Bay, WA Urban Area","Birch Bay, WA",53073,16768,8583,13.056,0.152,48.947603,-122.735883
07770,"Birdsboro--Amity, PA Urban Area","Birdsboro, PA",42011,16870,6643,8.562,0.011,40.265603,-75.749569
07786,"Birmingham, AL Urban Area","Birmingham, AL",01073,774698,349875,509.272,3.591,33.475252,-86.784185
07813,"Bisbee, AZ Urban Area","Bisbee, AZ",04003,4574,3046,3.153,0.0,31.403482,-109.92094
07840,"Bishop, CA Urban Area","Bishop, CA",06027,11396,5314,5.49,0.007,37.365976,-118.415939
07921,"Bismarck, ND Urban Area","Bismarck, ND",38015,98700,46207,41.854,0.404,46.819848,-100.801005
07948,"Blackfoot, ID Urban Area","Blackfoot, ID",16011,14523,5458,7.513,0.177,43.198466,-112.359362
07975,"Black River Falls, WI Urban Area","Black River Falls, WI",55053,4289,2139,3.704,0.003,44.296885,-90.849189
08002,"Blacksburg--Christiansburg, VA Urban Area","Blacksburg, VA",51121,71691,29706,33.979,0.052,37.185325,-80.41322
08083,"Blackwell, OK Urban Area","Blackwell, OK",40071,5886,3089,3.844,0.007,36.800234,-97.291627
08137,"Blair, NE Urban Area","Blair, NE",31177,8022,3645,8.181,0.0,41.536927,-96.122542
08164,"Blairsville, PA Urban Area","Blairsville, PA",42063,5937,3225,5.221,0.002,40.443953,-79.264054
08353,"Bloomfield, NM Urban Area","Bloomfield, NM",35045,7549,3182,6.248,0.034,36.715582,-107.975039
08380,"Bloomington, IN Urban Area","Bloomington, IN",18105,109904,51364,43.036,0.005,39.166091,-86.552907
08407,"Bloomington--Normal, IL Urban Area","Bloomington, IL",17113,134278,60058,50.362,0.221,40.493771,-88.978991
08434,"Bloomsburg--Berwick, PA Urban Area","Bloomsburg, PA",42037,40149,18491,20.745,0.535,41.027288,-76.36377
08470,"Blowing Rock, NC Urban Area","Blowing Rock, NC",37189,858,1880,3.199,0.044,36.129182,-81.666326
08515,"Bluefield, WV--VA Urban Area","Bluefield, WV",54055,41564,20869,38.699,0.139,37.269528,-81.255889
08542,"Bluffton, IN Urban Area","Bluffton, IN",18179,10393,4813,6.504,0.077,40.751443,-85.162221
08601,"Bluffton East--Hilton Head Island, SC Urban Area","Bluffton East, SC",45013,69692,44776,63.241,1.821,32.253775,-80.867672
08607,"Bluffton West, SC Urban Area","Bluffton West, SC",45013,34102,15632,23.305,0.034,32.271051,-80.966117
08623,"Blythe, CA--AZ Urban Area","Blythe, CA",06065,11803,5063,6.201,0.043,33.609113,-114.579244
08650,"Blytheville, AR Urban Area","Blytheville, AR",05093,15765,7907,14.532,0.0,35.931893,-89.917459
08704,"Boerne, TX Urban Area","Boerne, TX",48259,19978,8033,9.651,0.0,29.779302,-98.718712
08731,"Bogalusa, LA Urban Area","Bogalusa, LA",22117,10698,5233,10.903,0.03,30.780619,-89.86476
08785,"Boise City, ID Urban Area","Boise City, ID",16001,441221,183449,139.23,1.939,43.617616,-116.301508
08812,"Bolivar, MO Urban Area","Bolivar, MO",29167,10402,4539,5.916,0.008,37.606027,-93.414705
08866,"Bolivar, TN Urban Area","Bolivar, TN",47069,5680,2606,4.741,0.0,35.264176,-89.000544
08920,"Bonham, TX Urban Area","Bonham, TX",48147,8127,3538,5.029,0.0,33.587318,-96.181486
08974,"Bonita Springs--Estero, FL Urban Area","Bonita Springs, FL",12021,434792,286678,242.959,21.019,26.23611,-81.746589
09005,"Bonne Terre, MO Urban Area","Bonne Terre, MO",29187,6387,1953,2.202,0.021,37.922602,-90.546587
09028,"Boone, IA Urban Area","Boone, IA",19015,12193,5701,7.609,0.001,42.056076,-93.875484
09055,"Boone, NC Urban Area","Boone, NC",37189,26500,10327,18.187,0.068,36.213842,-81.665197
09109,"Booneville, MS Urban Area","Booneville, MS",28117,5904,2647,6.37,0.01,34.661137,-88.555919
09163,"Boonville, IN Urban Area","Boonville, IN",18173,6474,3065,2.829,0.013,38.046847,-87.270935
09190,"Boonville, MO Urban Area","Boonville, MO",29053,7701,3240,5.824,0.022,38.961439,-92.746203
09200,"Boothbay Harbor, ME Urban Area","Boothbay Harbor, ME",23015,3120,3740,11.226,4.181,43.835485,-69.622164
09217,"Borger, TX Urban Area","Borger, TX",48233,13085,6369,9.417,0.02,35.666797,-101.399608
09271,"Boston, MA--NH Urban Area","Boston, MA",25017,4355159,1806643,1655.887,71.69,42.378999,-71.142344
09298,"Boulder, CO Urban Area","Boulder, CO",08013,119355,52846,25.449,0.253,40.023878,-105.243811
09325,"Boulder City, NV Urban Area","Boulder City, NV",32003,13953,7034,5.724,0.0,35.973364,-114.840711
09352,"Bowie, TX Urban Area","Bowie, TX",48337,5433,2542,4.315,0.018,33.560626,-97.84825
09379,"Bowling Green, KY Urban Area","Bowling Green, KY",21227,101122,43402,52.176,0.293,36.963135,-86.440824
09433,"Bowling Green, OH Urban Area","Bowling Green, OH",39173,30311,12821,11.338,0.064,41.374021,-83.65123
09460,"Box Elder, SD Urban Area","Box Elder, SD",46103,12388,4424,6.083,0.0,44.147281,-103.065446
09487,"Boyne City, MI Urban Area","Boyne City, MI",26029,4133,2708,5.316,0.066,45.206022,-85.000772
09514,"Bozeman, MT Urban Area","Bozeman, MT",30031,61676,27575,21.393,0.053,45.677082,-111.055647
09536,"Bradenton--Sarasota--Venice, FL Urban Area","Bradenton, FL",12115,804106,461128,404.282,39.55,27.28683,-82.457015
09541,"Bradford, PA--NY Urban Area","Bradford, PA",42083,11069,4723,5.743,0.112,41.963843,-78.641214
