GEOID,Name,Short Name,Primary County GEOID,Population,Housing Units,Land Area,Water Area,Latitude,Longitude
48259,"Lawrenceburg, KY Urban Area","Lawrenceburg, KY",21005,14279,5905,6.555,0.03,38.048882,-84.903028
48286,"Lawrenceburg, TN Urban Area","Lawrenceburg, TN",47099,12270,5741,9.668,0.0,35.246787,-87.328666
48340,"Lawrenceville, IL Urban Area","Lawrenceville, IL",17101,5159,2407,2.604,0.0,38.724085,-87.690012
48394,"Lawton, OK Urban Area","Lawton, OK",40031,89466,39968,46.834,0.053,34.619667,-98.425135
48421,"Lead, SD Urban Area","Lead, SD",46081,4344,2722,3.884,0.0,44.355301,-103.769418
48448,"Leadville, CO Urban Area","Leadville, CO",08065,3869,2148,2.495,0.0,39.251295,-106.300004
48475,"Leavenworth, KS Urban Area","Leavenworth, KS",20103,47142,17946,21.676,0.032,39.297504,-94.920244
48502,"Lebanon, IN Urban Area","Lebanon, IN",18011,16997,7280,8.362,0.0,40.050329,-86.474153
48529,"Lebanon, KY Urban Area","Lebanon, KY",21155,6434,2893,4.942,0.012,37.565971,-85.255996
48556,"Lebanon, MO Urban Area","Lebanon, MO",29105,14860,6809,12.401,0.058,37.669549,-92.660851
48583,"Lebanon, NH--VT Urban Area","Lebanon, NH",33009,31189,14140,30.163,2.648,43.662151,-72.274991
48637,"Lebanon, OR Urban Area","Lebanon, OR",41043,23627,9747,8.545,0.145,44.525755,-122.902499
48664,"Lebanon, PA Urban Area","Lebanon, PA",42075,75694,32351,32.709,0.148,40.343807,-76.400594
48691,"Lebanon, TN Urban Area","Lebanon, TN",47189,39509,16229,30.292,0.004,36.201613,-86.333893
48745,"Lee, MA Urban Area","Lee, MA",25003,8187,5268,12.558,0.164,42.358257,-73.281685
48799,"Leesburg--Eustis--Tavares, FL Urban Area","Leesburg, FL",12069,156462,79029,86.095,8.256,28.793147,-81.894709
48826,"Lee's Summit, MO Urban Area","Lee's Summit, MO",29095,93572,37732,37.595,1.07,38.89798,-94.384348
48853,"Leesville, LA Urban Area","Leesville, LA",22115,8426,4663,6.882,0.039,31.139911,-93.26874
48890,"Lehighton--Palmerton--Jim Thorpe, PA Urban Area","Lehighton, PA",42025,18345,8946,9.859,0.202,40.829443,-75.6899
48915,"Leisuretowne, NJ Urban Area","Leisuretowne, NJ",34005,4604,2655,3.277,0.116,39.906926,-74.70695
48934,"Leitchfield, KY Urban Area","Leitchfield, KY",21085,5891,2731,5.458,0.01,37.484412,-86.283385
48988,"Le Mars, IA Urban Area","Le Mars, IA",19149,10155,4403,5.468,0.0,42.783984,-96.171195
49015,"Lemoore, CA Urban Area","Lemoore, CA",06031,26999,9510,6.672,0.0,36.29743,-119.788959
49042,"Lemoore Station, CA Urban Area","Lemoore Station, CA",06031,5847,1675,5.104,0.0,36.254324,-119.909778
49096,"Leominster--Fitchburg, MA Urban Area","Leominster, MA",25027,111322,48866,52.932,2.119,42.555827,-71.82478
49109,"Leonardtown, MD Urban Area","Leonardtown, MD",24037,5921,2286,6.178,0.06,38.292428,-76.644181
49150,"Le Roy, NY Urban Area","Le Roy, NY",36037,4791,2478,2.988,0.001,42.975934,-77.98203
49204,"Levelland, TX Urban Area","Levelland, TX",48219,12585,5373,6.405,0.002,33.582648,-102.366433
49231,"Lewes--Rehoboth Beach, DE Urban Area","Lewes, DE",10005,41998,33594,38.303,0.692,38.728714,-75.168507
49258,"Lewisburg, TN Urban Area","Lewisburg, TN",47117,12145,5298,9.383,0.006,35.450431,-86.790852
49285,"Lewisburg, WV Urban Area","Lewisburg, WV",54025,7618,4108,7.004,0.114,37.793991,-80.444234
49312,"Lewiston, ID--WA Urban Area","Lewiston, ID",16069,55013,24305,27.928,0.526,46.389205,-117.027315
49339,"Lewiston, ME Urban Area","Lewiston, ME",23001,60997,27683,31.417,0.841,44.078705,-70.19548
49366,"Lewistown, MT Urban Area","Lewistown, MT",30027,6064,3134,2.918,0.0,47.063523,-109.435634
49393,"Lewistown, PA Urban Area","Lewistown, PA",42087,20423,10539,11.984,0.144,40.62745,-77.581037
49474,"Lexington, NE Urban Area","Lexington, NE",31047,10519,3522,4.71,0.013,40.779618,-99.74495
49528,"Lexington, TN Urban Area","Lexington, TN",47077,7104,2945,6.654,0.002,35.657522,-88.392274
49555,"Lexington, VA Urban Area","Lexington, VA",51163,9699,3531,5.283,0.048,37.792133,-79.430972
49582,"Lexington-Fayette, KY Urban Area","Lexington, KY",21067,314112,144453,83.994,0.794,38.026279,-84.496408
49594,"Lexington Park--California--Chesapeake Ranch Estates, MD Urban Area","Lexington Park, MD",24037,63017,26894,46.654,2.09,38.304183,-76.488072
49609,"Libby, MT Urban Area","Libby, MT",30053,4555,2312,3.515,0.065,48.388601,-115.560777
49636,"Liberal, KS Urban Area","Liberal, KS",20175,19107,7360,10.616,0.221,37.046113,-100.926755
49663,"Liberty, NY Urban Area","Liberty, NY",36105,5228,2282,3.069,0.0,41.796707,-74.753378
49690,"Liberty, TX Urban Area","Liberty, TX",48291,7525,2989,5.374,0.0,30.071772,-94.784627
49771,"Lihue, HI Urban Area","Lihue, HI",15007,16351,5278,7.042,0.03,21.975808,-159.35893
49852,"Lima, OH Urban Area","Lima, OH",39003,68925,31484,48.659,1.46,40.734696,-84.128399
49906,"Lincoln, IL Urban Area","Lincoln, IL",17107,14249,6668,8.101,0.004,40.150707,-89.373773
49933,"Lincoln, NE Urban Area","Lincoln, NE",31109,291499,126205,94.174,1.151,40.808955,-96.678944
49945,"Lincoln, NH Urban Area","Lincoln, NH",33009,1654,2603,4.921,0.178,44.060465,-71.671045
49955,"Lincoln Beach, OR Urban Area","Lincoln Beach, OR",41041,4519,4133,2.918,0.014,44.84928,-124.046602
49960,"Lincoln City, OR Urban Area","Lincoln City, OR",41041,10672,7540,6.672,0.987,44.977799,-124.001419
49987,"Lincolnton, NC Urban Area","Lincolnton, NC",37109,23053,10489,28.408,0.136,35.481299,-81.229294
50014,"Lindale--Hideaway, TX Urban Area","Lindale, TX",48423,12238,5575,12.297,0.52,32.465695,-95.410169
50041,"Lindsay, CA Urban Area","Lindsay, CA",06107,13639,4123,2.885,0.0,36.208231,-119.088949
50122,"Lindstrom--Chisago City, MN Urban Area","Lindstrom, MN",27025,8418,3950,6.223,2.792,45.410209,-92.832621
50149,"Linton, IN Urban Area","Linton, IN",18055,5096,2615,2.98,0.0,39.037399,-87.163593
50230,"Litchfield, IL Urban Area","Litchfield, IL",17135,6365,3035,4.879,0.009,39.173509,-89.6585
50257,"Litchfield, MN Urban Area","Litchfield, MN",27093,6531,3099,3.903,0.017,45.126832,-94.522409
50275,"Litchfield Beach, SC Urban Area","Litchfield Beach, SC",45043,15896,11295,17.015,0.414,33.45419,-79.132262
50311,"Little Falls, MN Urban Area","Little Falls, MN",27097,9431,4335,7.41,0.432,45.9798,-94.359148
50338,"Little Falls, NY Urban Area","Little Falls, NY",36043,4568,2286,3.379,0.093,43.045575,-74.857516
50365,"Littlefield, TX Urban Area","Littlefield, TX",48279,5620,2539,2.997,0.0,33.916724,-102.333932
50392,"Little Rock, AR Urban Area","Little Rock, AR",05119,463689,217568,267.815,3.157,34.756962,-92.326276
50419,"Littlestown, PA Urban Area","Littlestown, PA",42001,6672,2654,3.455,0.004,39.74507,-77.083323
50473,"Live Oak (Sutter County), CA Urban Area","Live Oak (Sutter County), CA",06101,9096,2891,1.665,0.0,39.274853,-121.663541
50500,"Live Oak, FL Urban Area","Live Oak, FL",12121,7132,2924,5.299,0.001,30.292525,-82.988445
50533,"Livermore--Pleasanton--Dublin, CA Urban Area","Livermore, CA",06001,233604,85233,65.259,1.385,37.690335,-121.829039
50581,"Livingston, CA Urban Area","Livingston, CA",06047,14450,3582,2.637,0.0,37.384386,-120.722665
50608,"Livingston, MT Urban Area","Livingston, MT",30067,9173,4543,4.48,0.031,45.657039,-110.566586
50662,"Livingston, TX Urban Area","Livingston, TX",48373,5832,2751,6.893,0.011,30.714335,-94.936924
50743,"Lockhart, TX Urban Area","Lockhart, TX",48055,13059,5317,8.325,0.006,29.870717,-97.678582
50770,"Lock Haven, PA Urban Area","Lock Haven, PA",42035,14313,6462,7.898,0.328,41.126685,-77.45454
50797,"Lockport, NY Urban Area","Lockport, NY",36063,35014,16758,17.741,0.039,43.149859,-78.683852
50851,"Lodi, CA Urban Area","Lodi, CA",06077,73046,26825,16.34,0.1,38.139895,-121.279286
50932,"Logan, OH Urban Area","Logan, OH",39073,7707,3379,4.317,0.091,39.53658,-82.403316
50959,"Logan, UT Urban Area","Logan, UT",49005,116781,38885,47.725,0.034,41.728738,-111.833766
50986,"Logan, WV Urban Area","Logan, WV",54045,9898,4641,6.415,0.604,37.849146,-81.993663
51013,"Logansport, IN Urban Area","Logansport, IN",18017,20783,8569,10.477,0.263,40.753735,-86.352138
51025,"Loíza--Vieques (Loíza Municipio), PR Urban Area","Loíza, PR",72087,14829,8063,4.392,0.065,18.422327,-65.848987
51040,"Lompoc, CA Urban Area","Lompoc, CA",06083,53452,18068,9.81,0.028,34.666153,-120.466341
51121,"London, OH Urban Area","London, OH",39097,10145,4659,5.079,0.01,39.898443,-83.440688
51131,"London--Corbin, KY Urban Area","London, KY",21125,36378,16075,47.944,0.238,37.133373,-84.119167
51148,"Long Beach, WA Urban Area","Long Beach, WA",53049,3452,2895,2.926,0.001,46.342214,-124.051605
51175,"Longmont, CO Urban Area","Longmont, CO",08013,100789,43293,24.169,0.274,40.16821,-105.107689
51202,"Long Neck, DE Urban Area","Long Neck, DE",10005,21048,15141,22.018,1.626,38.635815,-75.169593
51256,"Longview, TX Urban Area","Longview, TX",48183,108710,47419,90.256,0.354,32.506079,-94.759257
51283,"Longview, WA--OR Urban Area","Longview, WA",53015,70926,29940,35.192,1.073,46.154832,-122.935587
51364,"Lorain--Elyria, OH Urban Area","Lorain, OH",39093,199610,92913,90.614,0.885,41.41584,-82.146654
51418,"Los Alamos, NM Urban Area","Los Alamos, NM",35028,13503,6221,8.521,0.001,35.892535,-106.300043
51445,"Los Angeles--Long Beach--Anaheim, CA Urban Area","Los Angeles, CA",06037,12068061,4395771,1636.826,18.636,33.984996,-118.122395
51472,"Los Banos, CA Urban Area","Los Banos, CA",06047,46776,13723,8.406,0.0,37.062273,-120.844078
51499,"Los Lunas, NM Urban Area","Los Lunas, NM",35061,55850,21557,39.419,0.013,34.76728,-106.71537
51520,"Los Osos, CA Urban Area","Los Osos, CA",06079,14857,6463,3.832,0.006,35.317751,-120.837103
51580,"Louisa, KY--WV Urban Area","Louisa, KY",21127,4695,2199,3.633,0.083,38.110053,-82.603837
51755,"Louisville/Jefferson County, KY--IN Urban Area","Louisville, KY",21111,974137,442517,400.86,7.828,38.222617,-85.687344
51769,"Lovington, NM Urban Area","Lovington, NM",35025,11520,4105,4.805,0.006,32.94652,-103.353902
51796,"Lowell, IN Urban Area","Lowell, IN",18089,11014,4253,5.275,0.026,41.295097,-87.41862
51823,"Lowell, MI Urban Area","Lowell, MI",26081,7450,3131,5.555,0.133,42.938178,-85.366016
51877,"Lubbock, TX Urban Area","Lubbock, TX",48303,275784,121131,106.274,0.836,33.557478,-101.895339
51958,"Ludington, MI Urban Area","Ludington, MI",26105,12263,7195,12.696,0.049,43.974531,-86.424464
51985,"Lufkin, TX Urban Area","Lufkin, TX",48005,39517,16766,36.74,0.219,31.330789,-94.73227
52039,"Luling, TX Urban Area","Luling, TX",48055,5447,2567,2.809,0.0,29.680784,-97.646072
52066,"Lumberton, NC Urban Area","Lumberton, NC",37155,22811,10139,20.374,0.074,34.637658,-79.014543
52093,"Luray, VA Urban Area","Luray, VA",51139,4648,2629,4.099,0.02,38.66508,-78.449496
52147,"Luverne, MN Urban Area","Luverne, MN",27133,4697,2141,2.285,0.004,43.654813,-96.212001
52201,"Lynchburg, VA Urban Area","Lynchburg, VA",51680,127013,54646,91.598,0.728,37.389999,-79.20133
52228,"Lynden, WA Urban Area","Lynden, WA",53073,16173,6117,5.314,0.011,48.94992,-122.454803
52363,"McAlester, OK Urban Area","McAlester, OK",40121,19611,9221,15.527,0.036,34.922458,-95.749725
52390,"McAllen, TX Urban Area","McAllen, TX",48215,790326,276267,326.218,0.649,26.237246,-98.182781
52403,"McCall, ID Urban Area","McCall, ID",16085,3704,4821,6.041,0.069,44.912845,-116.095714
52417,"Macclenny, FL Urban Area","Macclenny, FL",12003,10988,3984,8.454,0.0,30.280498,-82.13553
52471,"McComb, MS Urban Area","McComb, MS",28113,15912,7526,13.105,0.06,31.252876,-90.456106
52525,"McCook, NE Urban Area","McCook, NE",31145,7353,3794,5.243,0.0,40.204598,-100.620718
52552,"McFarland, CA Urban Area","McFarland, CA",06029,14025,3733,1.862,0.0,35.676638,-119.231185
52606,"McGregor, TX Urban Area","McGregor, TX",48309,5560,2101,2.317,0.0,31.437008,-97.406825
52623,"McHenry Northwest--Wonder Lake, IL Urban Area","McHenry Northwest, IL",17111,6049,2492,2.347,0.007,42.390105,-88.345338
52633,"McKenzie, TN Urban Area","McKenzie, TN",47017,5627,2257,4.401,0.0,36.136493,-88.513551
52672,"McKinleyville, CA Urban Area","McKinleyville, CA",06023,15954,6978,7.885,0.011,40.950513,-124.105032
52695,"McKinney--Frisco, TX Urban Area","McKinney, TX",48085,539051,191937,151.641,1.47,33.190397,-96.785991
52741,"McMinnville, OR Urban Area","McMinnville, OR",41071,41859,15711,12.805,0.0,45.21433,-123.174881
52768,"McMinnville, TN Urban Area","McMinnville, TN",47177,15800,7216,13.221,0.0,35.685168,-85.783834
52795,"Macomb, IL Urban Area","Macomb, IL",17109,15367,7627,8.745,0.007,40.460197,-90.6757
52822,"Macon-Bibb County, GA Urban Area","Macon, GA",13021,136977,64531,99.273,0.818,32.844701,-83.676551
52876,"Macon, MO Urban Area","Macon, MO",29121,5297,2741,5.078,0.017,39.739902,-92.469092
52903,"McPherson, KS Urban Area","McPherson, KS",20113,13909,6199,8.641,0.066,38.368813,-97.662389
52984,"Madera, CA Urban Area","Madera, CA",06039,82114,22481,20.96,0.0,36.973385,-120.068622
53065,"Madison, GA Urban Area","Madison, GA",13211,4693,2362,4.792,0.031,33.590819,-83.468926
53092,"Madison, IN Urban Area","Madison, IN",18077,17813,7895,10.77,0.046,38.774167,-85.38841
53146,"Madison, SD Urban Area","Madison, SD",46079,6158,2878,4.309,0.0,44.007903,-97.111317
53200,"Madison, WI Urban Area","Madison, WI",55025,454320,209596,149.704,1.281,43.041969,-89.492208
53227,"Madisonville, KY Urban Area","Madisonville, KY",21107,20971,10566,16.114,0.118,37.331707,-87.497411
53254,"Madisonville, TN Urban Area","Madisonville, TN",47123,5629,2492,7.169,0.0,35.516073,-84.361039
53308,"Madras, OR Urban Area","Madras, OR",41031,7555,2639,4.678,0.0,44.632563,-121.129586
53322,"Magalia, CA Urban Area","Magalia, CA",06007,6971,3201,5.878,0.003,39.832719,-121.603663
53362,"Magnolia, AR Urban Area","Magnolia, AR",05027,10290,4498,8.778,0.035,33.273939,-93.229828
53389,"Mahanoy City, PA Urban Area","Mahanoy City, PA",42107,3699,2258,0.829,0.0,40.811981,-76.144468
53416,"Mahomet, IL Urban Area","Mahomet, IL",17019,11967,4384,6.874,0.054,40.195454,-88.387947
53524,"Malone, NY Urban Area","Malone, NY",36033,6274,3180,3.452,0.066,44.852239,-74.291901
53551,"Malvern, AR Urban Area","Malvern, AR",05059,9069,4101,6.698,0.0,34.368485,-92.810082
53605,"Mammoth Lakes, CA Urban Area","Mammoth Lakes, CA",06051,7233,9835,3.76,0.002,37.636867,-118.97912
53686,"Manchester, IA Urban Area","Manchester, IA",19055,4912,2532,3.609,0.0,42.489484,-91.458578
53740,"Manchester, NH Urban Area","Manchester, NH",33011,162370,70001,80.632,1.903,42.992156,-71.474376
53767,"Manchester, TN Urban Area","Manchester, TN",47031,13541,5542,10.437,0.006,35.469229,-86.072132
53794,"Mandeville--Covington, LA Urban Area","Mandeville, LA",22103,115380,47986,84.329,1.721,30.433677,-90.107066
53834,"Manhattan, IL Urban Area","Manhattan, IL",17197,8533,2883,2.935,0.0,41.429576,-87.990762
53848,"Manhattan, KS Urban Area","Manhattan, KS",20161,60726,27224,25.839,0.058,39.184723,-96.604163
53902,"Manistee, MI Urban Area","Manistee, MI",26101,8417,4738,9.083,0.155,44.228277,-86.30644
53956,"Manitowoc, WI Urban Area","Manitowoc, WI",55071,46559,22153,23.526,0.985,44.112481,-87.654651
53983,"Mankato, MN Urban Area","Mankato, MN",27013,60494,25772,25.631,0.307,44.172275,-93.997161
54037,"Manning, SC Urban Area","Manning, SC",45027,4678,2295,3.879,0.0,33.693283,-80.218242
54050,"Manor, TX Urban Area","Manor, TX",48453,19881,6528,5.326,0.0,30.357963,-97.527207
54064,"Mansfield, LA Urban Area","Mansfield, LA",22031,5701,2776,4.059,0.026,32.032663,-93.703022
54091,"Mansfield, OH Urban Area","Mansfield, OH",39139,74354,33288,47.684,0.093,40.759245,-82.527334
54145,"Manteca, CA Urban Area","Manteca, CA",06077,89523,29210,20.471,0.315,37.799839,-121.229936
54172,"Manteno, IL Urban Area","Manteno, IL",17091,10503,4647,6.009,0.095,41.24814,-87.835008
54199,"Manteo, NC Urban Area","Manteo, NC",37055,6749,3351,5.272,0.061,35.924169,-75.70323
54280,"Maquoketa, IA Urban Area","Maquoketa, IA",19097,6089,2864,3.779,0.006,42.06025,-90.667403
54295,"Marana, AZ Urban Area","Marana, AZ",04019,11228,3808,3.256,0.0,32.44643,-111.213686
54307,"Marathon, FL Urban Area","Marathon, FL",12087,9788,7157,5.546,2.004,24.721293,-81.054638
54334,"Marble Falls, TX Urban Area","Marble Falls, TX",48053,7744,3709,5.516,0.202,30.573249,-98.278664
54388,"Marengo, IL Urban Area","Marengo, IL",17111,7156,2904,3.809,0.0,42.249157,-88.605417
54442,"Marianna, FL Urban Area","Marianna, FL",12063,5274,2868,4.346,0.007,30.778072,-85.235756
54477,"Maricopa, AZ Urban Area","Maricopa, AZ",04021,62802,21894,13.2,0.071,33.059434,-112.014535
54486,"Marietta, OH--WV Urban Area","Marietta, OH",39167,21090,10697,13.554,0.615,39.416913,-81.43927
54496,"Marinette--Menominee, WI--MI Urban Area","Marinette, WI",55075,23474,12047,14.788,0.732,45.095692,-87.649854
54577,"Marion, IN Urban Area","Marion, IN",18053,40623,18782,21.862,0.075,40.540166,-85.662785
54631,"Marion, NC Urban Area","Marion, NC",37111,11590,5712,13.643,0.049,35.681507,-82.014442
54658,"Marion, OH Urban Area","Marion, OH",39101,42502,17511,18.393,0.092,40.586453,-83.119332
54685,"Marion, SC Urban Area","Marion, SC",45067,6875,3117,5.43,0.0,34.178281,-79.390336
54712,"Marion, VA Urban Area","Marion, VA",51173,7224,3525,7.168,0.029,36.842091,-81.501961
54722,"Marion--Herrin, IL Urban Area","Marion, IL",17199,39114,20013,32.973,0.444,37.755476,-88.997902
54739,"Marion Oaks, FL Urban Area","Marion Oaks, FL",12083,22669,8257,16.328,0.006,29.003751,-82.196202
54793,"Marksville, LA Urban Area","Marksville, LA",22009,6903,3080,6.412,0.0,31.108904,-92.059012
54820,"Marlin, TX Urban Area","Marlin, TX",48145,5421,2523,4.103,0.044,31.308041,-96.890922
54874,"Marquette, MI Urban Area","Marquette, MI",26103,24548,11568,12.691,0.051,46.532076,-87.404505
54901,"Marseilles, IL Urban Area","Marseilles, IL",17099,4033,2111,2.392,0.0,41.334766,-88.704489
54955,"Marshall, MI Urban Area","Marshall, MI",26025,7620,3635,4.59,0.029,42.278549,-84.961378
54982,"Marshall, MN Urban Area","Marshall, MN",27083,13783,6210,8.293,0.0,44.448224,-95.788518
55009,"Marshall, MO Urban Area","Marshall, MO",29195,13344,5225,6.815,0.072,39.113875,-93.199059
55036,"Marshall, TX Urban Area","Marshall, TX",48203,21772,8968,16.165,0.021,32.537314,-94.359182
55090,"Marshalltown, IA Urban Area","Marshalltown, IA",19127,27353,10869,12.098,0.01,42.03276,-92.9168
55117,"Marshfield, MO Urban Area","Marshfield, MO",29225,7599,3122,5.336,0.003,37.340871,-92.908921
55144,"Marshfield, WI Urban Area","Marshfield, WI",55141,19262,9826,11.27,0.0,44.663306,-90.166586
55171,"Martin, TN Urban Area","Martin, TN",47183,10790,4727,8.037,0.0,36.3406,-88.858218
55225,"Martinsville, IN Urban Area","Martinsville, IN",18109,12277,5520,6.174,0.187,39.424497,-86.422466
55252,"Martinsville, VA Urban Area","Martinsville, VA",51089,31292,15599,39.788,0.085,36.688852,-79.889562
55306,"Marysville, OH Urban Area","Marysville, OH",39159,26666,10040,11.557,0.149,40.232732,-83.365056
55333,"Marysville, WA Urban Area","Marysville, WA",53061,162038,60768,67.799,1.886,48.050099,-122.134593
55360,"Maryville, MO Urban Area","Maryville, MO",29147,11293,5070,5.613,0.006,40.342581,-94.873662
55375,"Mascoutah, IL Urban Area","Mascoutah, IL",17163,8743,3107,3.211,0.054,38.498077,-89.804384
55414,"Mason City, IA Urban Area","Mason City, IA",19033,25758,13581,14.667,0.274,43.152258,-93.200648
55468,"Massena, NY Urban Area","Massena, NY",36089,11300,5611,6.168,0.331,44.933749,-74.886114
55495,"Mathis, TX Urban Area","Mathis, TX",48409,5336,2543,3.243,0.0,28.102217,-97.831057
55534,"Mattawan, MI Urban Area","Mattawan, MI",26159,6523,2411,6.343,0.064,42.226429,-85.790089
55576,"Mattoon, IL Urban Area","Mattoon, IL",17029,17082,8882,8.344,0.018,39.477837,-88.367702
55603,"Mauldin--Simpsonville, SC Urban Area","Mauldin, SC",45045,165356,66924,101.203,0.849,34.766652,-82.255938
55738,"Mayagüez, PR Urban Area","Mayagüez, PR",72097,90994,49995,50.145,0.034,18.192264,-67.113824
55765,"Mayfield, KY Urban Area","Mayfield, KY",21083,12175,5730,9.411,0.061,36.74102,-88.643001
55792,"Mayodan, NC Urban Area","Mayodan, NC",37157,4695,2616,4.593,0.008,36.393981,-79.975984
55819,"Maysville, KY--OH Urban Area","Maysville, KY",21161,9983,5187,8.96,1.509,38.646944,-83.780986
55832,"Maytown--Marietta, PA Urban Area","Maytown, PA",42071,8057,3092,3.132,0.007,40.067751,-76.571305
55846,"Mayville, WI Urban Area","Mayville, WI",55027,5169,2322,2.743,0.088,43.496988,-88.546481
55900,"Meadville, PA Urban Area","Meadville, PA",42039,20075,9137,15.76,0.006,41.642941,-80.154693
55927,"Mecca, CA Urban Area","Mecca, CA",06065,5670,1952,0.626,0.0,33.575023,-116.071512
55954,"Mechanicville, NY Urban Area","Mechanicville, NY",36091,12553,6183,6.544,0.022,42.92083,-73.684675
55981,"Medford, OR Urban Area","Medford, OR",41029,174156,75139,63.02,0.152,42.331637,-122.84409
56008,"Medford, WI Urban Area","Medford, WI",55119,4163,2001,3.032,0.029,45.137412,-90.347979
56035,"Medina, NY Urban Area","Medina, NY",36073,6310,2995,3.056,0.072,43.218236,-78.389959
56062,"Medina, OH Urban Area","Medina, OH",39103,45664,19030,27.779,0.277,41.127119,-81.842637
56074,"Melissa--Anna, TX Urban Area","Melissa, TX",48085,42957,14310,16.947,0.073,33.331261,-96.561922
56116,"Memphis, TN--MS--AR Urban Area","Memphis, TN",47157,1049210,456322,491.267,3.567,35.084143,-89.915288
56143,"Mena, AR Urban Area","Mena, AR",05113,5582,2641,6.97,0.046,34.586683,-94.247662
56170,"Mendota, CA Urban Area","Mendota, CA",06019,13694,3224,4.263,0.003,36.745374,-120.391753
56197,"Mendota, IL Urban Area","Mendota, IL",17099,6772,3009,2.851,0.027,41.551222,-89.116251
56224,"Menomonie, WI Urban Area","Menomonie, WI",55033,17156,6603,10.625,1.599,44.887224,-91.909055
56251,"Merced, CA Urban Area","Merced, CA",06047,154143,48669,43.077,0.012,37.301766,-120.46947
56290,"Meredith, NH Urban Area","Meredith, NH",33001,3935,2577,4.9,2.066,43.6527,-71.4965
56305,"Meridian, MS Urban Area","Meridian, MS",28075,33675,17546,29.477,0.162,32.383907,-88.703756
56359,"Merrill, WI Urban Area","Merrill, WI",55069,9332,4614,7.518,0.639,45.178569,-89.702511
56413,"Mesquite, NV--AZ Urban Area","Mesquite, NV",32003,20407,11547,9.97,0.0,36.815113,-114.084185
56467,"Metropolis, IL Urban Area","Metropolis, IL",17127,5682,3103,2.988,0.003,37.157888,-88.728696
56521,"Mexia, TX Urban Area","Mexia, TX",48293,6377,2668,4.491,0.032,31.678286,-96.478695
56548,"Mexico, MO Urban Area","Mexico, MO",29007,11810,5074,6.712,0.06,39.167392,-91.886914
56602,"Miami--Fort Lauderdale, FL Urban Area","Miami, FL",12099,6079180,2644370,1244.175,87.664,26.196181,-80.230395
56629,"Miami, OK Urban Area","Miami, OK",40115,15232,6780,9.205,0.011,36.890865,-94.87594
56656,"Michigan City--La Porte, IN--MI Urban Area","Michigan City, IN",18091,69763,36678,49.16,1.655,41.711237,-86.832139
56737,"Middlebury, VT Urban Area","Middlebury, VT",50001,5849,1663,4.377,0.103,44.011384,-73.163376
56791,"Middleport, OH--WV Urban Area","Middleport, OH",54053,6082,3100,5.514,0.557,38.974903,-81.936631
56818,"Middlesborough, KY--TN Urban Area","Middlesborough, KY",21013,13849,6521,11.791,0.098,36.619993,-83.731847
56829,"Middleton, ID Urban Area","Middleton, ID",16027,10830,3860,4.468,0.022,43.710033,-116.609895
56845,"Middletown, DE Urban Area","Middletown, DE",10003,45166,15891,24.16,0.109,39.496834,-75.655156
56899,"Middletown, NY Urban Area","Middletown, NY",36071,60827,23274,25.961,0.134,41.440598,-74.387442
56926,"Middletown, OH Urban Area","Middletown, OH",39017,93751,37121,53.615,0.349,39.482219,-84.364064
56980,"Midland, MI Urban Area","Midland, MI",26111,52860,23889,38.145,0.38,43.628847,-84.232535
57007,"Midland, TX Urban Area","Midland, TX",48329,144241,60211,68.288,0.056,31.997137,-102.106821
57034,"Midlothian, TX Urban Area","Midlothian, TX",48139,33055,11114,24.72,0.205,32.454199,-96.98507
57088,"Milan, MI Urban Area","Milan, MI",26161,8155,2864,3.394,0.081,42.084889,-83.678251
57115,"Milan, TN Urban Area","Milan, TN",47053,7940,3318,5.998,0.0,35.913173,-88.759662
57169,"Miles City, MT Urban Area","Miles City, MT",30017,9232,4520,4.634,0.003,46.405823,-105.838944
57196,"Milford, DE Urban Area","Milford, DE",10005,19004,8416,11.971,0.215,38.907579,-75.425805
57223,"Milledgeville, GA Urban Area","Milledgeville, GA",13009,22108,10375,19.784,0.018,33.082986,-83.237554
57304,"Millersburg, PA Urban Area","Millersburg, PA",42043,4729,2136,1.873,0.0,40.540803,-76.951693
57319,"Millington, TN Urban Area","Millington, TN",47157,13474,6010,12.689,0.016,35.337638,-89.88389
57331,"Millinocket, ME Urban Area","Millinocket, ME",23019,3059,2233,3.297,0.052,45.652825,-68.698553
57358,"Millsboro, DE Urban Area","Millsboro, DE",10005,11111,4665,6.634,0.074,38.576801,-75.280902
57402,"Milton, VT Urban Area","Milton, VT",50007,6275,2398,5.531,0.085,44.631984,-73.13033
57412,"Milton-Freewater, OR Urban Area","Milton, OR",41059,8473,3420,3.336,0.0,45.947511,-118.390778
57439,"Milton, PA Urban Area","Milton, PA",42119,28184,12355,17.913,0.037,41.022368,-76.876288
57466,"Milwaukee, WI Urban Area","Milwaukee, WI",55079,1295353,581409,463.682,10.083,43.051223,-88.085101
57493,"Minden, LA Urban Area","Minden, LA",22119,13359,6450,12.917,0.09,32.603437,-93.297383
57547,"Mineola, TX Urban Area","Mineola, TX",48499,5724,2542,5.655,0.059,32.672727,-95.490657
57574,"Mineral Wells, TX Urban Area","Mineral Wells, TX",48363,14327,6040,8.856,0.026,32.805701,-98.098329
57628,"Minneapolis--St. Paul, MN Urban Area","Minneapolis, MN",27053,2912164,1221577,1014.793,66.967,44.974458,-93.283077
57655,"Minot, ND Urban Area","Minot, ND",38101,50743,24927,26.67,0.034,48.233606,-101.278541
57698,"Minster--New Bremen, OH Urban Area","Minster, OH",39011,5999,2491,4.179,0.0,40.417632,-84.376679
57709,"Mission Viejo--Lake Forest--Laguna Niguel, CA Urban Area","Mission Viejo, CA",06059,642445,264944,163.632,0.641,33.566169,-117.665161
57736,"Missoula, MT Urban Area","Missoula, MT",30063,90611,42294,44.292,0.227,46.879863,-114.03166
57817,"Mitchell, SD Urban Area","Mitchell, SD",46035,15686,7990,9.113,1.066,43.719201,-98.03186
57844,"Moab, UT Urban Area","Moab, UT",49019,8170,4307,6.62,0.0,38.553993,-109.527052
