GEOID,Name,Short Name,Primary County GEOID,Population,Housing Units,Land Area,Water Area,Latitude,Longitude
19639,"Conneaut Lakeshore, PA Urban Area","Conneaut Lakeshore, PA",42039,2195,2250,3.768,1.487,41.620949,-80.2964
19666,"Connell, WA Urban Area","Connell, WA",53021,5098,1196,2.176,0.0,46.66276,-118.862263
19686,"Connellsville, PA Urban Area","Connellsville, PA",42051,30349,15167,20.603,0.067,40.087289,-79.568722
19693,"Connersville, IN Urban Area","Connersville, IN",18041,14392,6863,7.452,0.015,39.65511,-85.136364
19801,"Conway, AR Urban Area","Conway, AR",05045,68307,29626,32.88,0.278,35.068797,-92.447413
19811,"Conway, NH Urban Area","Conway, NH",33003,6090,4402,8.759,0.291,44.035719,-71.117232
19828,"Cookeville, TN Urban Area","Cookeville, TN",47141,51193,22536,45.461,0.095,36.164149,-85.510318
19862,"Coolbaugh--Pocono Pines, PA Urban Area","Coolbaugh, PA",42089,24775,13178,19.742,0.853,41.136177,-75.399832
19882,"Coolidge, AZ Urban Area","Coolidge, AZ",04021,13004,4675,4.139,0.008,32.977854,-111.527291
19936,"Coos Bay, OR Urban Area","Coos Bay, OR",41011,30859,14450,14.627,0.922,43.381129,-124.242771
19970,"Coquí--Jobos, PR Urban Area","Coquí, PR",72057,12588,5779,4.443,0.005,17.97768,-66.220724
19990,"Coquille, OR Urban Area","Coquille, OR",41011,4323,2019,3.434,0.114,43.176394,-124.184232
20044,"Corcoran, CA Urban Area","Corcoran, CA",06031,22954,4798,6.287,0.0,36.085557,-119.562105
20071,"Cordele, GA Urban Area","Cordele, GA",13081,10935,5361,8.598,0.028,31.965338,-83.773823
20098,"Corinth, MS Urban Area","Corinth, MS",28003,12171,6649,12.8,0.015,34.930271,-88.512112
20125,"Corinth, NY Urban Area","Corinth, NY",36113,3771,2309,2.96,0.161,43.240864,-73.83371
20152,"Cornelia--Baldwin, GA Urban Area","Cornelia, GA",13137,19211,6860,19.566,0.095,34.529832,-83.536151
20206,"Corning, CA Urban Area","Corning, CA",06103,8366,2816,3.047,0.0,39.924565,-122.185733
20233,"Corning, NY Urban Area","Corning, NY",36101,20085,10266,10.78,0.207,42.16986,-77.12003
20247,"Corona de Tucson, AZ Urban Area","Corona de Tucson, AZ",04019,7512,2555,3.432,0.0,31.944623,-110.77761
20287,"Corpus Christi, TX Urban Area","Corpus Christi, TX",48355,339512,143810,129.274,1.431,27.749359,-97.417229
20314,"Corry, PA Urban Area","Corry, PA",42049,5894,3152,4.162,0.001,41.926474,-79.628929
20341,"Corsicana, TX Urban Area","Corsicana, TX",48349,24434,9511,15.522,0.134,32.089989,-96.470025
20368,"Cortez, CO Urban Area","Cortez, CO",08083,8328,3785,4.248,0.027,37.35292,-108.573847
20395,"Cortland, NY Urban Area","Cortland, NY",36023,24252,10776,10.344,0.047,42.600283,-76.191401
20422,"Corvallis, OR Urban Area","Corvallis, OR",41003,67102,28922,17.453,0.047,44.567815,-123.292341
20442,"Corydon, IN Urban Area","Corydon, IN",18061,5829,2914,3.589,0.0,38.224839,-86.131514
20476,"Coshocton, OH Urban Area","Coshocton, OH",39031,12366,5769,7.81,0.06,40.263665,-81.85002
20503,"Cottage Grove, OR Urban Area","Cottage Grove, OR",41039,11706,4931,5.248,0.068,43.790043,-123.055552
20595,"Cottonwood (Yavapai County)--Verde Village, AZ Urban Area","Cottonwood (Yavapai County), AZ",04025,30595,15227,16.906,0.0,34.729118,-112.016803
20719,"Covington, TN Urban Area","Covington, TN",47167,7670,3386,5.998,0.0,35.569225,-89.647845
20746,"Covington, VA Urban Area","Covington, VA",51580,7758,4015,7.327,0.23,37.780677,-79.983041
20773,"Coxsackie, NY Urban Area","Coxsackie, NY",36039,4978,1473,3.763,0.014,42.353344,-73.820934
20827,"Craig, CO Urban Area","Craig, CO",08081,9600,4508,5.501,0.0,40.517095,-107.557206
20881,"Crawfordsville, IN Urban Area","Crawfordsville, IN",18107,17508,7721,9.771,0.03,40.041143,-86.903643
20890,"Crawfordville, FL Urban Area","Crawfordville, FL",12129,10756,4165,9.719,0.0,30.189998,-84.355266
20899,"Creedmoor, NC Urban Area","Creedmoor, NC",37077,7288,3163,6.791,0.033,36.124252,-78.702111
20908,"Crescent City, CA Urban Area","Crescent City, CA",06015,15752,6685,16.336,0.087,41.78645,-124.201626
20980,"Cresson, PA Urban Area","Cresson, PA",42021,6494,2995,3.881,0.0,40.467534,-78.576693
20985,"Crestline, OH Urban Area","Crestline, OH",39033,4530,2112,3.181,0.005,40.784932,-82.740578
20989,"Crestline--Lake Arrowhead, CA Urban Area","Crestline, CA",06071,20007,18169,16.851,1.343,34.250962,-117.228384
21016,"Creston, IA Urban Area","Creston, IA",19175,7447,3813,4.515,0.002,41.059112,-94.36358
21043,"Crestview, FL Urban Area","Crestview, FL",12091,46419,18091,39.844,0.694,30.767535,-86.560304
21070,"Creswell, OR Urban Area","Creswell, OR",41039,5819,2258,2.443,0.017,43.92394,-123.014252
21097,"Crete, NE Urban Area","Crete, NE",31151,7482,2604,2.603,0.031,40.624767,-96.956078
21151,"Crisfield, MD Urban Area","Crisfield, MD",24039,3365,1965,2.688,0.153,37.986601,-75.845759
21205,"Crockett, TX Urban Area","Crockett, TX",48225,6140,2835,6.56,0.0,31.313523,-95.453712
21232,"Crookston, MN Urban Area","Crookston, MN",27119,7567,3841,4.649,0.0,47.776408,-96.606622
21340,"Crossett, AR Urban Area","Crossett, AR",05003,7107,3794,9.01,0.182,33.140109,-91.956963
21394,"Crossville, TN Urban Area","Crossville, TN",47035,19012,9852,26.801,1.163,35.936478,-85.038234
21421,"Crowley, LA Urban Area","Crowley, LA",22001,12641,6599,7.085,0.007,30.213804,-92.376695
21448,"Crozet, VA Urban Area","Crozet, VA",51003,9259,3843,4.487,0.027,38.065113,-78.697295
21502,"Crystal City, TX Urban Area","Crystal City, TX",48507,6673,2668,3.542,0.004,28.688755,-99.826764
21529,"Crystal River, FL Urban Area","Crystal River, FL",12017,7611,4488,14.085,1.151,28.895754,-82.586197
21556,"Crystal Springs, MS Urban Area","Crystal Springs, MS",28029,4578,2135,3.956,0.01,31.984777,-90.356084
21610,"Cuero, TX Urban Area","Cuero, TX",48123,7096,2993,4.365,0.018,29.0928,-97.285992
21637,"Cullman, AL Urban Area","Cullman, AL",01043,22050,10071,21.491,0.176,34.16882,-86.842334
21664,"Cullowhee, NC Urban Area","Cullowhee, NC",37099,9318,3183,6.097,0.0,35.320004,-83.19196
21691,"Culpeper, VA Urban Area","Culpeper, VA",51047,22834,8127,9.371,0.025,38.472101,-78.001689
21745,"Cumberland, MD--WV--PA Urban Area","Cumberland, MD",24001,46019,21823,31.695,0.263,39.643168,-78.806255
21772,"Cushing, OK Urban Area","Cushing, OK",40119,7427,3632,9.312,0.012,35.961002,-96.757194
21853,"Cynthiana, KY Urban Area","Cynthiana, KY",21097,6479,2824,2.989,0.055,38.38556,-84.295239
21893,"Dade City, FL Urban Area","Dade City, FL",12101,21816,8116,14.397,0.376,28.353423,-82.207452
21934,"Dahlonega, GA Urban Area","Dahlonega, GA",13187,5868,1307,3.147,0.0,34.540295,-83.978409
21988,"Dalhart, TX Urban Area","Dalhart, TX",48111,7837,3300,3.499,0.002,36.059498,-102.513642
22015,"Dallas, OR Urban Area","Dallas, OR",41053,18053,7091,5.496,0.0,44.922399,-123.311383
22042,"Dallas--Fort Worth--Arlington, TX Urban Area","Dallas, TX",48113,5773403,2286716,1746.896,24.768,32.810975,-96.972981
22069,"Dalton, GA Urban Area","Dalton, GA",13313,66641,25562,57.489,0.077,34.779018,-84.975143
22096,"Danbury, CT--NY Urban Area","Danbury, CT",09001,169915,68698,118.489,6.018,41.449654,-73.423258
22177,"Dansville, NY Urban Area","Dansville, NY",36051,4626,2522,3.195,0.0,42.563946,-77.703175
22204,"Danville, IL Urban Area","Danville, IL",17183,39285,19033,27.794,0.862,40.130703,-87.62932
22231,"Danville, KY Urban Area","Danville, KY",21021,19825,8363,13.614,0.052,37.629298,-84.778352
22253,"Danville, VA--NC Urban Area","Danville, VA",51590,46704,24158,36.312,0.558,36.598752,-79.41411
22260,"Danville--Mahoning, PA Urban Area","Danville, PA",42093,9901,4825,5.212,0.017,40.962405,-76.600958
22366,"Davenport, IA--IL Urban Area","Davenport, IA",19163,284216,130646,134.859,7.604,41.523198,-90.51448
22420,"Davis, CA Urban Area","Davis, CA",06113,77419,30267,12.162,0.035,38.550686,-121.735394
22528,"Dayton, OH Urban Area","Dayton, OH",39113,672115,310228,319.892,2.625,39.732177,-84.176024
22555,"Dayton, TN Urban Area","Dayton, TN",47143,9135,4311,9.119,0.237,35.490032,-85.020285
22582,"Dayton, TX Urban Area","Dayton, TX",48291,6992,2842,5.407,0.0,30.042912,-94.894291
22612,"Daytona Beach--Palm Coast--Port Orange, FL Urban Area","Daytona Beach, FL",12127,413788,224641,212.359,12.204,29.27457,-81.086166
22616,"Dayton Northeast, NV Urban Area","Dayton Northeast, NV",32019,6648,2520,3.839,0.0,39.303689,-119.527558
22622,"Dayton Southwest, NV Urban Area","Dayton Southwest, NV",32019,7850,3190,4.498,0.001,39.254137,-119.561571
22690,"Decatur, AL Urban Area","Decatur, AL",01103,61581,26608,43.47,0.406,34.587541,-87.007257
22717,"Decatur, IL Urban Area","Decatur, IL",17115,85975,42258,55.107,2.933,39.844714,-88.934605
22744,"Decatur, IN Urban Area","Decatur, IN",18001,10329,4990,6.559,0.006,40.831679,-84.928689
22771,"Decatur, TX Urban Area","Decatur, TX",48497,6701,3074,6.198,0.0,33.228366,-97.591669
22798,"Decorah, IA Urban Area","Decorah, IA",19191,7738,3376,5.196,0.043,43.30391,-91.782758
22879,"Defiance, OH Urban Area","Defiance, OH",39039,17472,8154,12.369,0.535,41.285146,-84.35937
22933,"DeFuniak Springs, FL Urban Area","DeFuniak Springs, FL",12131,7458,3088,7.17,0.267,30.733743,-86.130341
22960,"DeKalb, IL Urban Area","DeKalb, IL",17037,65140,27699,25.632,0.242,41.948874,-88.723629
22987,"Delano, CA Urban Area","Delano, CA",06029,45849,12665,7.365,0.0,35.766201,-119.243036
22995,"Delano, MN Urban Area","Delano, MN",27171,6539,2502,3.093,0.0,45.037616,-93.787974
23041,"Delavan, WI Urban Area","Delavan, WI",55127,12170,7194,9.095,2.755,42.616512,-88.639722
23080,"Delhi, CA Urban Area","Delhi, CA",06047,10237,2754,2.34,0.0,37.428666,-120.779779
23176,"Delphos, OH Urban Area","Delphos, OH",39003,7201,3356,3.437,0.028,40.844657,-84.336129
23203,"Del Rio, TX Urban Area","Del Rio, TX",48465,43161,16298,18.808,0.083,29.370854,-100.876596
23230,"Delta, CO Urban Area","Delta, CO",08029,8424,3487,6.227,0.05,38.745424,-108.061934
23311,"Deltona, FL Urban Area","Deltona, FL",12127,217654,86519,108.983,4.857,28.989805,-81.259659
23338,"Deming, NM Urban Area","Deming, NM",35029,14820,6973,8.197,0.0,32.259968,-107.74299
23365,"Demopolis, AL Urban Area","Demopolis, AL",01091,5741,3216,4.549,0.032,32.505005,-87.831898
23419,"Denison, IA Urban Area","Denison, IA",19047,8005,3050,4.493,0.009,42.019313,-95.350061
23473,"Denton, MD Urban Area","Denton, MD",24011,5109,1840,3.266,0.036,38.879421,-75.824452
23500,"Denton--Lewisville, TX Urban Area","Denton, TX",48121,443487,170819,150.48,1.897,33.194971,-97.121054
23513,"Denton Southwest, TX Urban Area","Denton Southwest, TX",48121,15189,5985,7.062,0.025,33.107475,-97.235558
23527,"Denver--Aurora, CO Urban Area","Denver, CO",08059,2684170,1145976,644.541,11.326,39.732149,-104.959388
23608,"De Queen, AR Urban Area","De Queen, AR",05133,5970,2383,4.812,0.02,34.045369,-94.344746
23662,"DeRidder, LA Urban Area","DeRidder, LA",22011,11836,5643,14.528,0.087,30.86032,-93.301199
23716,"Desert Hot Springs, CA Urban Area","Desert Hot Springs, CA",06065,44471,19386,14.079,0.0,33.947753,-116.492531
23743,"Des Moines, IA Urban Area","Des Moines, IA",19153,550488,238739,224.743,2.79,41.620998,-93.665233
23797,"De Soto, MO Urban Area","De Soto, MO",29099,7746,3640,4.4,0.14,38.137337,-90.553847
23824,"Detroit, MI Urban Area","Detroit, MI",26125,3750464,1658714,1284.827,33.684,42.486581,-83.22742
23851,"Detroit Lakes, MN Urban Area","Detroit Lakes, MN",27005,10654,6038,9.202,9.93,46.782961,-95.842545
23878,"Devils Lake, ND Urban Area","Devils Lake, ND",38071,7367,3854,5.072,0.006,48.112591,-98.871116
23986,"DeWitt, IA Urban Area","DeWitt, IA",19045,4870,2005,4.004,0.0,41.820728,-90.539337
24008,"Dexter, MI Urban Area","Dexter, MI",26161,5462,2132,2.494,0.001,42.33548,-83.88877
24013,"Dexter, MO Urban Area","Dexter, MO",29207,9398,4371,7.744,0.094,36.792688,-89.973792
24040,"Diamondhead, MS Urban Area","Diamondhead, MS",28045,8956,4400,5.067,0.087,30.394333,-89.365506
24094,"Dickinson, ND Urban Area","Dickinson, ND",38089,25195,11874,12.258,0.077,46.892651,-102.788149
24121,"Dickson, TN Urban Area","Dickson, TN",47043,16183,6990,16.451,0.063,36.060236,-87.364102
24175,"Dillon, MT Urban Area","Dillon, MT",30001,4551,2134,2.747,0.0,45.226238,-112.632487
24202,"Dillon, SC Urban Area","Dillon, SC",45033,9040,4312,6.33,0.043,34.425884,-79.362661
24256,"Discovery Bay, CA Urban Area","Discovery Bay, CA",06013,15838,6335,4.202,1.112,37.905173,-121.606277
24283,"Dixon, CA Urban Area","Dixon, CA",06095,19071,6941,4.395,0.003,38.449389,-121.829238
24310,"Dixon, IL Urban Area","Dixon, IL",17103,16023,6794,7.817,0.385,41.841414,-89.480978
24337,"Dodge City, KS Urban Area","Dodge City, KS",20057,27623,9790,10.918,0.128,37.75868,-100.014881
24364,"Dodgeville, WI Urban Area","Dodgeville, WI",55049,4950,2488,3.255,0.0,42.965206,-90.130736
24391,"Donaldsonville, LA Urban Area","Donaldsonville, LA",22005,12267,5146,15.649,0.582,30.1091,-90.892665
24445,"Dos Palos, CA Urban Area","Dos Palos, CA",06047,8146,2599,2.293,0.0,36.975468,-120.633497
24472,"Dothan, AL Urban Area","Dothan, AL",01069,73964,34408,55.087,0.15,31.22612,-85.425301
24499,"Douglas, AZ Urban Area","Douglas, AZ",04003,15763,6394,5.481,0.0,31.351555,-109.542755
24526,"Douglas, GA Urban Area","Douglas, GA",13069,13842,6096,16.594,0.208,31.507796,-82.857974
24539,"Douglas, MI Urban Area","Douglas, MI",26005,3208,2678,4.232,0.541,42.653231,-86.196877
24553,"Douglas, WY Urban Area","Douglas, WY",56009,6583,3000,3.279,0.0,42.75634,-105.385329
24580,"Dover, DE Urban Area","Dover, DE",10001,126204,50230,72.304,1.036,39.146316,-75.548114
24607,"Dover--Rochester, NH--ME Urban Area","Dover, NH",33017,72912,34250,52.312,1.039,43.258739,-70.918667
24634,"Dowagiac, MI Urban Area","Dowagiac, MI",26027,6103,3176,3.557,0.047,41.983186,-86.108771
24715,"Dublin, GA Urban Area","Dublin, GA",13175,20147,8576,20.431,0.164,32.541185,-82.918763
24796,"DuBois, PA Urban Area","DuBois, PA",42033,11311,5639,7.159,0.055,41.121167,-78.765056
24823,"Dubuque, IA--IL Urban Area","Dubuque, IA",19061,69500,31794,34.167,0.088,42.503272,-90.699886
24850,"Duluth, MN--WI Urban Area","Duluth, MN",27137,120021,54999,66.866,4.947,46.766514,-92.127793
24877,"Dumas, AR Urban Area","Dumas, AR",05041,4117,2168,3.107,0.0,33.884012,-91.486732
24904,"Dumas, TX Urban Area","Dumas, TX",48341,14391,5686,4.937,0.0,35.864893,-101.965345
24931,"Duncan, OK Urban Area","Duncan, OK",40137,20377,9873,13.611,0.064,34.509608,-97.962631
24958,"Dundee, MI Urban Area","Dundee, MI",26115,5532,2724,3.901,0.037,41.961787,-83.661262
25012,"Dunkirk--Fredonia, NY Urban Area","Dunkirk, NY",36013,23412,11114,12.753,0.045,42.463071,-79.329028
25039,"Dunn, NC Urban Area","Dunn, NC",37085,14002,6590,11.111,0.053,35.317578,-78.636444
25093,"Du Quoin, IL Urban Area","Du Quoin, IL",17145,6040,3075,4.061,0.021,38.004412,-89.234301
25120,"Durand, MI Urban Area","Durand, MI",26155,5036,2215,3.78,0.048,42.919639,-83.991875
25147,"Durango, CO Urban Area","Durango, CO",08067,19222,9284,9.451,0.033,37.287672,-107.867815
25201,"Durant, OK Urban Area","Durant, OK",40013,20389,8744,12.006,0.016,33.992468,-96.398015
25216,"Durham, NH Urban Area","Durham, NH",33017,11605,2639,4.036,0.025,43.139235,-70.929903
25228,"Durham, NC Urban Area","Durham, NC",37063,399649,177635,183.355,1.307,35.966985,-78.937688
25237,"Duvall, WA Urban Area","Duvall, WA",53033,8485,2761,2.474,0.001,47.737654,-121.964426
25309,"Dyersburg, TN Urban Area","Dyersburg, TN",47045,16460,7730,12.976,0.088,36.045663,-89.383225
25390,"Eagle, CO Urban Area","Eagle, CO",08037,6793,2396,3.406,0.018,39.645064,-106.822397
25480,"Eagle Mountain, UT Urban Area","Eagle Mountain, UT",49049,11419,2910,2.021,0.0,40.309634,-112.011228
25498,"Eagle Pass, TX Urban Area","Eagle Pass, TX",48323,54354,18819,21.145,0.141,28.700079,-100.474047
25579,"Earlimart, CA Urban Area","Earlimart, CA",06107,7147,1828,1.35,0.0,35.883774,-119.270251
25598,"East Aurora, NY Urban Area","East Aurora, NY",36029,9535,4172,5.819,0.017,42.77019,-78.615811
25658,"East Hampton North--Springs--Northwest Harbor, NY Urban Area","East Hampton North, NY",36103,22083,16151,35.852,2.266,40.981411,-72.193604
25687,"East Liverpool, OH--WV--PA Urban Area","East Liverpool, OH",39029,21269,10782,15.526,0.629,40.644972,-80.578858
25714,"Eastman, GA Urban Area","Eastman, GA",13091,6446,2913,5.962,0.072,32.193868,-83.177877
25741,"Easton, MD Urban Area","Easton, MD",24041,18338,8434,11.15,0.133,38.770845,-76.070571
25768,"East Palestine, OH Urban Area","East Palestine, OH",39029,4546,2274,2.907,0.0,40.841613,-80.539724
25849,"East Stroudsburg--Stroudsburg, PA Urban Area","East Stroudsburg, PA",42089,49223,19674,38.937,0.315,41.010818,-75.234842
25876,"East Tawas, MI Urban Area","East Tawas, MI",26069,4508,3167,5.005,0.0,44.273921,-83.508635
25903,"East Troy, WI Urban Area","East Troy, WI",55127,5314,2570,4.141,0.638,42.79552,-88.398528
25930,"Eaton, CO Urban Area","Eaton, CO",08123,5728,2344,2.16,0.0,40.527435,-104.716851
25957,"Eaton, OH Urban Area","Eaton, OH",39135,7899,3807,4.494,0.001,39.749911,-84.635486
25984,"Eaton Rapids, MI Urban Area","Eaton Rapids, MI",26045,4809,2143,2.805,0.055,42.51142,-84.654426
26038,"Eau Claire, WI Urban Area","Eau Claire, WI",55035,106445,47217,62.496,3.951,44.8496,-91.459913
26065,"Ebensburg, PA Urban Area","Ebensburg, PA",42021,4424,2306,2.589,0.012,40.478698,-78.741113
26092,"Eden, NC Urban Area","Eden, NC",37157,15805,7594,14.235,0.016,36.504197,-79.748256
26119,"Edenton, NC Urban Area","Edenton, NC",37041,4447,2542,3.586,0.069,36.071606,-76.617043
26173,"Edgerton, WI Urban Area","Edgerton, WI",55105,8248,4237,6.19,0.191,42.838856,-89.055991
26227,"Edinboro, PA Urban Area","Edinboro, PA",42049,6231,2836,2.437,0.075,41.883992,-80.123253
26254,"Edna, TX Urban Area","Edna, TX",48239,5971,2669,3.695,0.0,28.974289,-96.650546
26275,"Edwards--Avon, CO Urban Area","Edwards, CO",08037,18335,12353,11.603,0.226,39.639076,-106.553834
26308,"Effingham, IL Urban Area","Effingham, IL",17049,13987,6348,13.576,0.029,39.125966,-88.531694
26362,"Elberton, GA Urban Area","Elberton, GA",13105,5940,2792,5.021,0.027,34.108838,-82.866255
26375,"Elburn, IL Urban Area","Elburn, IL",17089,6386,2690,3.565,0.0,41.887549,-88.459832
26389,"El Campo, TX Urban Area","El Campo, TX",48481,12773,5328,7.828,0.008,29.198508,-96.276623
26405,"El Centro, CA Urban Area","El Centro, CA",06025,75548,24201,19.352,0.018,32.802839,-115.560322
26422,"Eldersburg, MD Urban Area","Eldersburg, MD",24013,28659,10655,18.38,0.183,39.398706,-76.941698
26443,"Eldon, MO Urban Area","Eldon, MO",29131,4422,2259,3.338,0.0,38.350261,-92.576903
26470,"El Dorado, AR Urban Area","El Dorado, AR",05139,18124,8319,20.262,0.0,33.211502,-92.663028
26524,"El Dorado, KS Urban Area","El Dorado, KS",20015,12764,5934,7.446,0.008,37.819351,-96.866248
26659,"Elgin, TX Urban Area","Elgin, TX",48021,11962,4798,4.767,0.0,30.351263,-97.385115
26686,"Elizabeth City, NC Urban Area","Elizabeth City, NC",37139,24578,11016,16.516,0.009,36.298233,-76.226397
26750,"Elizabethtown--Radcliff, KY Urban Area","Elizabethtown, KY",21093,78639,33968,55.826,0.502,37.873754,-85.949265
26767,"Elk City, OK Urban Area","Elk City, OK",40009,11000,6108,9.013,0.0,35.408502,-99.407818
26794,"Elkhart, IN--MI Urban Area","Elkhart, IN",18039,148079,60605,94.939,3.123,41.662338,-85.924496
26821,"Elkhorn, WI Urban Area","Elkhorn, WI",55127,11827,5045,6.94,0.056,42.687332,-88.543002
26875,"Elkins, WV Urban Area","Elkins, WV",54083,10958,5275,7.121,0.0,38.935799,-79.855896
26902,"Elko, NV Urban Area","Elko, NV",32007,21302,9251,12.56,0.0,40.839773,-115.766306
26956,"Elkton, VA Urban Area","Elkton, VA",51165,5132,3012,4.805,0.025,38.402154,-78.617496
26983,"Ellensburg, WA Urban Area","Ellensburg, WA",53037,20776,10038,8.84,0.021,47.001086,-120.538461
27010,"Ellenville, NY Urban Area","Ellenville, NY",36111,6544,2602,3.303,0.03,41.725976,-74.386724
27037,"Ellijay, GA Urban Area","Ellijay, GA",13123,5135,3575,13.212,0.112,34.673133,-84.507983
27085,"Ellwood City, PA Urban Area","Ellwood City, PA",42073,12941,6548,7.36,0.125,40.852954,-80.280735
27118,"Elmira, NY Urban Area","Elmira, NY",36015,61939,29764,31.698,0.456,42.086405,-76.82518
27253,"El Paso, TX--NM Urban Area","El Paso, TX",48141,861502,320470,255.883,0.987,31.786147,-106.389782
27261,"El Paso de Robles (Paso Robles)--Atascadero, CA Urban Area","El Paso de Robles (Paso Robles), CA",06079,68310,27583,29.963,0.044,35.444573,-120.624475
27280,"El Reno, OK Urban Area","El Reno, OK",40017,15193,6200,8.715,0.005,35.520858,-97.956489
27290,"Elsa, TX Urban Area","Elsa, TX",48215,14952,5171,6.255,0.0,26.299313,-97.980961
27307,"Elwood, IN Urban Area","Elwood, IN",18095,9090,4361,4.632,0.0,40.272468,-85.837712
27361,"Ely, NV Urban Area","Ely, NV",32033,4275,2275,3.096,0.0,39.247316,-114.87507
27469,"Emmett, ID Urban Area","Emmett, ID",16045,10967,4315,5.73,0.079,43.875885,-116.496474
27523,"Emporia, KS Urban Area","Emporia, KS",20111,24087,11431,11.187,0.081,38.409579,-96.194519
27550,"Emporia, VA Urban Area","Emporia, VA",51595,7186,3330,6.542,0.059,36.69725,-77.544739
27631,"Enid, OK Urban Area","Enid, OK",40047,50056,22599,29.487,0.014,36.39856,-97.893218
27658,"Ennis, TX Urban Area","Ennis, TX",48139,21291,8009,12.418,0.349,32.328189,-96.631752
27685,"Enterprise, AL Urban Area","Enterprise, AL",01031,31071,13608,23.747,0.058,31.329219,-85.829648
27712,"Ephraim, UT Urban Area","Ephraim, UT",49039,5160,1569,1.746,0.0,39.357786,-111.582362
27739,"Ephrata, WA Urban Area","Ephrata, WA",53025,8383,3195,4.272,0.0,47.314246,-119.553286
27766,"Erie, PA Urban Area","Erie, PA",42049,187243,84348,73.339,0.23,42.088867,-80.112692
27793,"Erwin, TN Urban Area","Erwin, TN",47171,7984,3890,5.926,0.005,36.143997,-82.408735
27820,"Escalon, CA Urban Area","Escalon, CA",06077,7341,2924,1.988,0.0,37.792578,-120.99566
27847,"Escanaba, MI Urban Area","Escanaba, MI",26041,21954,10537,18.063,0.16,45.733032,-87.084194
27874,"Española, NM Urban Area","Española, NM",35039,23590,10684,20.137,0.163,36.012019,-106.047156
27901,"Estacada, OR Urban Area","Estacada, OR",41005,5586,2038,2.991,0.006,45.297043,-122.328629
27928,"Estes Park, CO Urban Area","Estes Park, CO",08069,8178,5768,12.15,0.271,40.359149,-105.529617
27955,"Estherville, IA Urban Area","Estherville, IA",19063,5742,2739,3.45,0.0,43.403532,-94.832892
28009,"Etowah, TN Urban Area","Etowah, TN",47107,4521,2246,4.505,0.0,35.338883,-84.528244
28063,"Eudora, KS Urban Area","Eudora, KS",20045,6071,2269,2.62,0.042,38.932378,-95.096848
28090,"Eufaula, AL--GA Urban Area","Eufaula, AL",01005,8678,4123,6.954,0.011,31.887533,-85.14468
28117,"Eugene, OR Urban Area","Eugene, OR",41039,270825,118094,73.485,0.064,44.069521,-123.085685
28144,"Eunice, LA Urban Area","Eunice, LA",22097,11631,5327,7.133,0.03,30.493373,-92.418098
28198,"Eureka, CA Urban Area","Eureka, CA",06023,46257,20712,18.795,1.459,40.775465,-124.166342
28225,"Eureka, IL Urban Area","Eureka, IL",17203,5363,2350,2.522,0.048,40.713988,-89.274949
28262,"Eureka, MO Urban Area","Eureka, MO",29189,15598,5361,9.335,0.017,38.491444,-90.643009
28306,"Evanston, WY Urban Area","Evanston, WY",56041,11878,5191,7.674,0.044,41.260088,-110.963739
28333,"Evansville, IN Urban Area","Evansville, IN",18163,206973,95182,112.753,1.124,38.007208,-87.526177
28360,"Evansville, WI Urban Area","Evansville, WI",55105,6408,2721,2.803,0.0,42.778401,-89.298617
28441,"Evergreen, CO Urban Area","Evergreen, CO",08059,9205,4206,9.46,0.085,39.645594,-105.336295
28495,"Excelsior Springs, MO Urban Area","Excelsior Springs, MO",29047,9864,4017,5.7,0.0,39.346037,-94.238117
28506,"Exeter, CA Urban Area","Exeter, CA",06107,10636,3604,2.87,0.0,36.294749,-119.148247
28511,"Exeter, NH Urban Area","Exeter, NH",33015,15784,7512,11.732,0.122,42.985696,-70.926615
28522,"Fabens, TX Urban Area","Fabens, TX",48141,4191,1927,1.691,0.023,31.505333,-106.154028
28549,"Fairbanks, AK Urban Area","Fairbanks, AK",02090,73993,31290,74.303,2.54,64.85531,-147.756344
28603,"Fairbury, NE Urban Area","Fairbury, NE",31095,3905,2050,2.36,0.004,40.144738,-97.176504
28657,"Fairfield, CA Urban Area","Fairfield, CA",06095,150238,50015,40.809,0.239,38.261965,-122.032389
28684,"Fairfield, IL Urban Area","Fairfield, IL",17191,4539,2573,3.262,0.025,38.380391,-88.369938
28711,"Fairfield, IA Urban Area","Fairfield, IA",19101,9352,4734,5.383,0.046,41.005895,-91.967453
28765,"Fairfield Glade, TN Urban Area","Fairfield Glade, TN",47035,8833,5281,9.635,0.4,36.009502,-84.885711
28766,"Fairhope--Daphne, AL Urban Area","Fairhope, AL",01003,76084,33244,59.065,0.26,30.620911,-87.904485
28846,"Fairmont, MN Urban Area","Fairmont, MN",27091,8250,4021,3.638,0.381,43.645881,-94.456578
28873,"Fairmont, WV Urban Area","Fairmont, WV",54049,33145,15830,20.188,0.704,39.464498,-80.158601
28981,"Fajardo, PR Urban Area","Fajardo, PR",72053,68618,39338,34.359,0.221,18.33623,-65.656006
28995,"Falcon, CO Urban Area","Falcon, CO",08041,21966,6882,8.476,0.0,38.963609,-104.605093
29008,"Falfurrias, TX Urban Area","Falfurrias, TX",48047,4475,2562,2.186,0.0,27.224195,-98.147155
29024,"Fallbrook, CA Urban Area","Fallbrook, CA",06073,40821,13997,26.026,0.028,33.353657,-117.225141
29035,"Fallon, NV Urban Area","Fallon, NV",32001,16066,7334,13.961,0.007,39.487723,-118.792263
29062,"Falls City, NE Urban Area","Falls City, NE",31147,4099,2034,3.353,0.005,40.062208,-95.599013
29089,"Fargo, ND--MN Urban Area","Fargo, ND",38017,220697,101319,77.731,0.114,46.858555,-96.826798
29116,"Faribault, MN Urban Area","Faribault, MN",27131,23908,9233,10.241,0.237,44.297461,-93.278929
29251,"Farmington, MO Urban Area","Farmington, MO",29187,32708,14148,18.053,0.04,37.853921,-90.51246
29278,"Farmington, NM Urban Area","Farmington, NM",35045,50995,20398,32.623,0.014,36.747223,-108.162366
29305,"Farmville, NC Urban Area","Farmville, NC",37147,4493,2238,2.948,0.0,35.594653,-77.591416
29332,"Farmville, VA Urban Area","Farmville, VA",51147,8208,3235,6.563,0.113,37.286016,-78.39096
29440,"Fayetteville, NC Urban Area","Fayetteville, NC",37051,326934,138092,195.924,2.05,35.052628,-78.97684
29467,"Fayetteville, TN Urban Area","Fayetteville, TN",47103,10717,4471,12.435,0.0,35.111264,-86.571838
